C1: start | D1: finish | E1: time | F1: points
A2: Men
A3: 1 | B3: Paul Trott | C3: 0.28680555555555554 | D3: 0.33888888888888885 | E3: 5.2083333333333336E-2 | F3: 300
A4: 2 | B4: Rigby Jerram | C4: 0.28749999999999998 | D4: 0.34166666666666662 | E4: 5.4166666666666669E-2 | F4: 300
A5: 3 | B5: Henry Syska | C5: 0.29097222222222224 | D5: 0.33888888888888885 | E5: 5.486111111111111E-2 | F5: 300
A6: 4 | B6: Neil Hazelhurst | C6: 0.29236111111111113 | D6: 0.34861111111111115 | E6: 5.6250000000000001E-2 | F6: 300
A7: 5 | B7: Chris Ellison | C7: 0.28819444444444448 | D7: 0.3444444444444445 | E7: 5.6250000000000001E-2 | F7: 300
A8: 6 | B8: Pat Mcvey | C8: 0.28402777777777777 | D8: 0.34027777777777773 | E8: 5.6250000000000001E-2 | F8: 300
A9: 7 | B9: Jonathan Broxap | C9: 0.28819444444444448 | D9: 0.34652777777777777 | E9: 5.8333333333333327E-2 | F9: 300
A10: 8 | B10: Jim Dominy | C10: 0.2722222222222222 | D10: 0.33263888888888887 | E10: 6.0416666666666667E-2 | F10: 300
A11: 9 | B11: Len Snowball | C11: 0.26874999999999999 | D11: 0.32916666666666666 | E11: 6.0416666666666667E-2 | F11: 300
A12: 10 | B12: Rod Carter | C12: 0.2638888888888889 | D12: 0.32430555555555557 | E12: 6.0416666666666667E-2 | F12: 300
A13: 11 | B13: David Chaplow | C13: 0.25138888888888888 | D13: 0.31180555555555556 | E13: 6.0416666666666667E-2 | F13: 300
A14: 12 | B14: Martin Bradley | C14: 0.29305555555555557 | D14: 0.35416666666666669 | E14: 6.1111111111111116E-2 | F14: 300
A15: 13 | B15: David Rosen | C15: 0.2638888888888889 | D15: 0.32500000000000001 | E15: 6.1111111111111116E-2 | F15: 300
A16: 14 | B16: Henry Adams | C16: 0.29652777777777778 | D16: 0.35833333333333334 | E16: 6.1805555555555558E-2 | F16: 300
A17: 15 | B17: Malcolm Campbell | C17: 0.29652777777777778 | D17: 0.35833333333333334 | E17: 6.1805555555555558E-2 | F17: 300
A18: 16 | B18: Loz Colyer | C18: 0.27986111111111112 | D18: 0.3444444444444445 | E18: 6.458333333333334E-2 | F18: 300
A19: 17 | B19: Karl Hutchinson | C19: 0.2902777777777778 | D19: 0.35555555555555557 | E19: 6.5277777777777782E-2 | F19: 300
A20: 18 | B20: Martin Oglesby | C20: 0.28055555555555556 | D20: 0.34861111111111115 | E20: 6.805555555555555E-2 | F20: 300
A21: 19 | B21: Mike Taylor | C21: 0.28888888888888892 | D21: 0.35833333333333334 | E21: 6.9444444444444434E-2 | F21: 300
A22: 20 | B22: Ray Morriss | C22: 0.27152777777777776 | D22: 0.34583333333333338 | E22: 7.4305555555555555E-2 | F22: 300
A23: 21 | B23: B Cheeseman | C23: 0.27152777777777776 | D23: 0.34583333333333338 | E23: 7.4305555555555555E-2 | F23: 300
A24: 22 | B24: Ken Shepherd | C24: 0.27152777777777776 | D24: 0.34583333333333338 | E24: 7.4305555555555555E-2 | F24: 300
A25: 23 | B25: Phill Wheatman | C25: 0.28402777777777777 | D25: 0.35972222222222222 | E25: 7.5694444444444439E-2 | F25: 300
A26: 24 | B26: Pete Bland | C26: 0.2902777777777778 | D26: 0.36736111111111108 | E26: 7.7083333333333337E-2 | F26: 300
A27: 25 | B27: P Ferguson | C27: 0.25069444444444444 | D27: 0.32916666666666666 | E27: 7.8472222222222221E-2 | F27: 300
A28: 26 | B28: Guy Brook | C28: 0.27291666666666664 | D28: 0.35416666666666669 | E28: 8.1250000000000003E-2 | F28: 300
A29: 27 | B29: Dave Thrower | C29: 0.25069444444444444 | D29: 0.31874999999999998 | E29: 6.805555555555555E-2 | F29: 290
A30: 28 | B30: James Tyson | C30: 0.25069444444444444 | D30: 0.31874999999999998 | E30: 6.805555555555555E-2 | F30: 290
A31: 29 | B31: David Owen | C31: 0.29375000000000001 | D31: 0.36875000000000002 | E31: 7.4999999999999997E-2 | F31: 290
A32: 30 | B32: Peter Corless | C32: 0.28958333333333336 | D32: 0.36527777777777781 | E32: 7.5694444444444439E-2 | F32: 290
A33: 31 | B33: Steve Ormron | C33: 0.2388888888888889 | D33: 0.31527777777777777 | E33: 7.6388888888888895E-2 | F33: 290
A34: 32 | B34: J D Barker | C34: 0.25 | D34: 0.32777777777777778 | E34: 7.7777777777777779E-2 | F34: 290
A35: 33 | B35: Nigel Walker | C35: 0.29444444444444445 | D35: 0.37708333333333338 | E35: 8.2638888888888887E-2 | F35: 290
A36: 34 | B36: Malcolm Hartley | C36: 0.26874999999999999 | D36: 0.35555555555555557 | E36: 8.6805555555555566E-2 | F36: 285
A37: 35 | B37: Phil Morgan | C37: 0.28472222222222221 | D37: 0.34652777777777777 | E37: 6.1805555555555558E-2 | F37: 280
A38: 36 | B38: James Innerdale | C38: 0.28194444444444444 | D38: 0.35416666666666669 | E38: 7.2222222222222229E-2 | F38: 280
A39: 37 | B39: BarryRobson | C39: 0.25 | D39: 0.32777777777777778 | E39: 7.7777777777777779E-2 | F39: 280
A40: 38 | B40: George North | C40: 0.29236111111111113 | D40: 0.35694444444444445 | E40: 6.458333333333334E-2 | F40: 270
A41: 39 | B41: John Hartley | C41: 0.26041666666666669 | D41: 0.33958333333333335 | E41: 7.9166666666666663E-2 | F41: 270
A42: 40 | B42: Sam Clifford | C42: 0.29652777777777778 | D42: 0.3756944444444445 | E42: 7.9166666666666663E-2 | F42: 250
A43: 41 | B43: David Aspen | C43: 0.28194444444444444 | D43: 0.36249999999999999 | E43: 8.0555555555555561E-2 | F43: 250
A44: 42 | B44: Guy Woolnough | C44: 0.29444444444444445 | D44: 0.37777777777777777 | E44: 8.3333333333333329E-2 | F44: 250
A45: 43 | B45: Peter Edge | C45: 0.2951388888888889 | D45: 0.3611111111111111 | E45: 6.5972222222222224E-2 | F45: 230
A46: 44 | B46: Doug Tilly | C46: 0.22500000000000001 | D46: 0.30763888888888891 | E46: 8.2638888888888887E-2 | F46: 190
A48: Ladies
A49: 1 | B49: Anne Plant | C49: 0.29166666666666669 | D49: 0.35138888888888892 | E49: 5.9722222222222225E-2 | F49: 300
A50: 2 | B50: Carol McNeill | C50: 0.24722222222222223 | D50: 0.31180555555555556 | E50: 6.458333333333334E-2 | F50: 300
A51: 3 | B51: Sharron Harris | C51: 0.2902777777777778 | D51: 0.35902777777777778 | E51: 6.8750000000000006E-2 | F51: 300
A52: 4 | B52: Jo Barratt | C52: 0.27291666666666664 | D52: 0.35416666666666669 | E52: 8.1250000000000003E-2 | F52: 300
A53: 5 | B53: Deb Cannon | C53: 0.25 | D53: 0.32847222222222222 | E53: 7.8472222222222221E-2 | F53: 290
A54: 6 | B54: Diane Walker | C54: 0.29444444444444445 | D54: 0.37708333333333338 | E54: 8.2638888888888887E-2 | F54: 290
A55: 7 | B55: Rachel Toyn | C55: 0.2902777777777778 | D55: 0.37013888888888885 | E55: 7.9861111111111105E-2 | F55: 280
A56: 8 | B56: Helen Snowball | C56: 0.26805555555555555 | D56: 0.35138888888888892 | E56: 8.3333333333333329E-2 | F56: 280
A57: 9 | B57: Jenny Stuart | C57: 0.28958333333333336 | D57: 0.37083333333333335 | E57: 8.1250000000000003E-2 | F57: 260
A58: 10 | B58: Emma Aspen | C58: 0.28194444444444444 | D58: 0.36249999999999999 | E58: 8.0555555555555561E-2 | F58: 250
A59: 11 | B59: Glenis Ferguson | C59: 0.25486111111111109 | D59: 0.3347222222222222 | E59: 7.9861111111111105E-2 | F59: 240
A60: 12 | B60: Sue Mansen | C60: 0.28333333333333333 | D60: 0.36875000000000002 | E60: 8.5416666666666655E-2 | F60: 235
A61: 13 | B61: Anita Laird | C61: 0.29583333333333334 | D61: 0.37708333333333338 | E61: 8.1250000000000003E-2 | F61: 230
A62: 14 | B62: C McCutcheon | C62: 0.29583333333333334 | D62: 0.37638888888888888 | E62: 8.2638888888888887E-2 | F62: 230
A63: 15 | B63: Jackie Fox | C63: 0.28055555555555556 | D63: 0.3527777777777778 | E63: 7.2222222222222229E-2 | F63: 220
A64: 16 | B64: Janet Bowden | C64: 0.28055555555555556 | D64: 0.3527777777777778 | E64: 7.2222222222222229E-2 | F64: 220
A65: 17 | B65: Katherine Edge | C65: 0.2951388888888889 | D65: 0.35833333333333334 | E65: 6.3194444444444442E-2 | F65: 160
A67: u16
A68: 1 | B68: James Crorie | C68: 0.23819444444444446 | D68: 0.31874999999999998 | E68: =+D68-C68 -> 8.0555555555555519E-2 | F68: 230
A69: 1 | B69: Lewis Remington | C69: 0.23819444444444446 | D69: 0.31874999999999998 | E69: =+D69-C69 -> 8.0555555555555519E-2 | F69: 230
B71: couples
A72: 1 | B72: Stuart Green/Fay Collins | C72: 0.27986111111111112 | D72: 0.36180555555555555 | E72: =+D72-C72 -> 8.1944444444444431E-2 | F72: 290
A73: 2 | B73: Rich/Susie Tyson | C73: 0.24861111111111112 | D73: 0.32013888888888892 | E73: =+D73-C73 -> 7.1527777777777801E-2 | F73: 250
A74: 3 | B74: Kate/Ben Davies | C74: 0.27847222222222223 | D74: 0.36388888888888887 | E74: =+D74-C74 -> 8.5416666666666641E-2 | F74: 225
A75: 4 | B75: Martin/Charlie Hebbert | C75: 0.28888888888888892 | D75: 0.36736111111111108 | E75: =+D75-C75 -> 7.8472222222222165E-2 | F75: 220
A76: 5 | B76: Harry/Pamela Wilson | C76: 0.25763888888888892 | D76: 0.34027777777777773 | E76: =+D76-C76 -> 8.2638888888888817E-2 | F76: 180
B78: families
A79: 1 | B79: Rowland | C79: 0.28611111111111115 | D79: 0.36527777777777781 | E79: =+D79-C79 -> 7.9166666666666663E-2 | F79: 300
A80: 2 | B80: Marwood | C80: 0.29722222222222222 | D80: 0.37847222222222227 | E80: =+D80-C80 -> 8.1250000000000003E-2 | F80: 180
A81: 3 | B81: Luke | C81: 0.29583333333333334 | D81: 0.3756944444444445 | E81: =+D81-C81 -> 7.986111111111116E-2 | F81: 170
A82: 4 | B82: Wagstaff | C82: 0.29583333333333334 | D82: 0.3756944444444445 | E82: =+D82-C82 -> 7.986111111111116E-2 | F82: 170