A1: Grizedale Night Event | B1: Organiser: Tony Richardson
A2: SPORTident results | B2: queries: Iain Smith

C1: time | D1: club | E1: controls | F1: penalty | G1: Total
E2: visited | F2: points
A3: 1 | B3: Iain Smith | C3: 62.55 | D3: LOC | E3: 16 | F3: 15 | G3: =SUM((E3*10)-F3) -> 145
A4: =SUM(A3)+1 -> 2 | B4: Derek Fryer | C4: 64.44 | D4: LOC | E4: 14 | F4: 25 | G4: =SUM((E4*10)-F4) -> 115
A5: =SUM(A4)+1 -> 3 | B5: Chris Roberts | C5: 62.13 | D5: SROC | E5: 12 | F5: 15 | G5: =SUM((E5*10)-F5) -> 105
A6: =SUM(A5)+1 -> 4 | B6: Simon Filmore | C6: 66.44 | D6: LOC | E6: 14 | F6: 35 | G6: =SUM((E6*10)-F6) -> 105
A7: =SUM(A6)+1 -> 5 | B7: Steve Burge | C7: 58.37 | D7: LOC | E7: 7 | G7: =SUM((E7*10)-F7) -> 70
A8: =SUM(A7)+1 -> 6 | B8: John Nash | C8: 67.49 | D8: LOC | E8: 11 | F8: 40 | G8: =SUM((E8*10)-F8) -> 70
A9: =SUM(A8)+1 -> 7 | B9: R + A Saunders | C9: 58.56 | D9: LOC | E9: 6 | G9: =SUM((E9*10)-F9) -> 60
A10: =SUM(A9)+1 -> 8 | B10: Claire Allison | C10: 59.22 | D10: LOC | E10: 6 | G10: =SUM((E10*10)-F10) -> 60
A11: =SUM(A10)+1 -> 9 | B11: Simon Coppock | C11: 62.08 | D11: DEE | E11: 7 | F11: 15 | G11: =SUM((E11*10)-F11) -> 55
A12: =SUM(A11)+1 -> 10 | B12: Carol McNeill | C12: 74.43 | D12: LOC | E12: 13 | F12: 75 | G12: =SUM((E12*10)-F12) -> 55
A13: =SUM(A12)+1 -> 11 | B13: Judy Warner | C13: 68.22 | D13: LOC | E13: 10 | F13: 45 | G13: =SUM((E13*10)-F13) -> 55
A14: =SUM(A13)+1 -> 12 | B14: Annaliese Sales + 1 | C14: 59.14 | D14: LOC | E14: 4 | G14: =SUM((E14*10)-F14) -> 40
A15: =SUM(A14)+1 -> 13 | B15: Mac Knowles | C15: 73.33 | D15: LOC | E15: 10 | F15: 70 | G15: =SUM((E15*10)-F15) -> 30
A16: =SUM(A15)+1 -> 14 | B16: Stephen Spooner | C16: 69.33 | D16: LOC | E16: 6 | F16: 50 | G16: =SUM((E16*10)-F16) -> 10
A17: =SUM(A16)+1 -> 15 | B17: Janet Nash | C17: 68.13 | D17: LOC | E17: 4 | F17: 45 | G17: =SUM((E17*10)-F17) -> -5
A18: =SUM(A17)+1 -> 16 | B18: Ron Smith | C18: 81.08 | D18: LOC | E18: 10 | F18: 110 | G18: =SUM((E18*10)-F18) -> -10