A3: Kendal Street O series 2002
A4: Event 3 Results
E5: Points | F5: Time | G5: Time | H5: Adjusted
B6: Name | C6: Class | D6: Category | E6: Scored | F6: Taken | G6: Penalties | H6: Score
A8: 1 | B8: George Robertson | C8: 60 mins | D8: Male | E8: 900 | F8: 59.10 | G8: 0 | H8: =H8-J8 -> 900
A9: 2 | B9: Paul Ferguson | C9: 60 mins | D9: Male | E9: 920 | F9: 66.00 | G9: 72 | H9: =H9-J9 -> 848
A10: 3 | B10: Phil Clarke | C10: 60 mins | D10: Male | E10: 810 | F10: 60.00 | G10: 0 | H10: =H10-J10 -> 810
A11: 4 | B11: Mike Hyde | C11: 60 mins | D11: Male | E11: 670 | F11: 61.46 | G11: 22 | H11: =H11-J11 -> 648
A12: 5 | B12: David Downes | C12: 60 mins | D12: Biker | E12: 630 | F12: 57.53 | G12: 0 | H12: =H12-J12 -> 630
A13: 6 | B13: Loz Colyer | C13: 60 mins | D13: Male | E13: 630 | F13: 60.00 | G13: 0 | H13: =H13-J13 -> 630
A14: 7 | B14: Martin Weeks | C14: 60 mins | D14: Male | E14: 620 | F14: 59.20 | G14: 0 | H14: =H14-J14 -> 620
A15: 8 | B15: Debbie Thompson | C15: 60 mins | D15: Female | E15: 580 | F15: 58.00 | G15: 0 | H15: =H15-J15 -> 580
A16: 9 | B16: Sue Owen | C16: 60 mins | D16: Female | E16: 570 | F16: 62.31 | G16: 31 | H16: =H16-J16 -> 539
A17: 10 | B17: John Nash | C17: 60 mins | D17: Male | E17: 570 | F17: 62.40 | G17: 32 | H17: =H17-J17 -> 538
A18: 11 | B18: Diane & Nigel Walker | C18: 60 mins | D18: Pairs | E18: 540 | F18: 61.48 | G18: 22 | H18: =H18-J18 -> 518
A19: 12 | B19: Jonty Mayo + Sharon Taylor | C19: 60 mins | D19: Pairs | E19: 500 | F19: 53.00 | G19: 0 | H19: =H19-J19 -> 500
A20: 13 | B20: Glenis Ferguson | C20: 60 mins | D20: Female | E20: 500 | F20: 60.00 | G20: 0 | H20: =H20-J20 -> 500
A21: 14 | B21: Janet Nash | C21: 60 mins | D21: Female | E21: 470 | F21: 59.10 | G21: 0 | H21: =H21-J21 -> 470
A22: 15 | B22: Diana Stamp | C22: 60 mins | D22: Female | E22: 470 | F22: 59.48 | G22: 0 | H22: =H22-J22 -> 470
A23: 16 | B23: David Wolfendale | C23: 60 mins | D23: Male | E23: 390 | F23: 53.39 | G23: 0 | H23: =H23-J23 -> 390
A24: 17 | B24: Charlotte Webb + Jane Senior | C24: 60 mins | D24: Female | E24: 380 | F24: 51.15 | G24: 0 | H24: =H24-J24 -> 380
A25: 18 | B25: Thomas & Laura Chaldecott | C25: 60 mins | D25: Junior | E25: 290 | F25: 53.41 | G25: 0 | H25: =H25-J25 -> 290
A26: 19 | B26: Karl, Danny, Darren | C26: 60 mins | D26: Pairs | E26: 260 | F26: 38.40 | G26: 0 | H26: =H26-J26 -> 260
A27: 20 | B27: Sarah Fulwood | C27: 60 mins | D27: Female | E27: 230 | F27: 34.16 | G27: 0 | H27: =H27-J27 -> 230
A28: 21 | B28: Matt Foxwell | C28: 60 mins | D28: Male | E28: 200 | F28: 27.24 | G28: 0 | H28: =H28-J28 -> 200