B1: Name | C1: Start | D1: Finish | E1: Points | F1: Penalty | G1: Score
B2: 60 mins course
A3: 1 | B3: Louise Sharp + 1 | C3: 0.76527777777777783 | D3: 0.80630787037037033 | E3: =10*(SUM(E3:N3))+20*(SUM(O3:X3))+30*(SUM(Y3:AH3))+40*(SUM(AI3:AR3)) -> 670 | F3: 0 | G3: =AS3-AT3 -> 670
A4: 2 | B4: Graham Walkden | C4: 0.76041666666666663 | D4: 0.80138888888888893 | E4: =10*(SUM(E4:N4))+20*(SUM(O4:X4))+30*(SUM(Y4:AH4))+40*(SUM(AI4:AR4)) -> 550 | F4: 0 | G4: =AS4-AT4 -> 550
A5: 3 | B5: Jonty Mayo | C5: 0.79236111111111107 | D5: 0.83125000000000004 | E5: =10*(SUM(E5:N5))+20*(SUM(O5:X5))+30*(SUM(Y5:AH5))+40*(SUM(AI5:AR5)) -> 540 | F5: 0 | G5: =AS5-AT5 -> 540
A6: 4 | B6: Jon Broxap | C6: 0.79027777777777775 | D6: 0.83125000000000004 | E6: =10*(SUM(E6:N6))+20*(SUM(O6:X6))+30*(SUM(Y6:AH6))+40*(SUM(AI6:AR6)) -> 530 | F6: 0 | G6: =AS6-AT6 -> 530
A7: 5 | B7: Sean Onions + 1 | C7: 0.76458333333333339 | D7: 0.80625000000000002 | E7: =10*(SUM(E7:N7))+20*(SUM(O7:X7))+30*(SUM(Y7:AH7))+40*(SUM(AI7:AR7)) -> 500 | F7: 0 | G7: =AS7-AT7 -> 500
A8: 6 | B8: Sue Owen | C8: 0.76736111111111116 | D8: 0.80763888888888891 | E8: =10*(SUM(E8:N8))+20*(SUM(O8:X8))+30*(SUM(Y8:AH8))+40*(SUM(AI8:AR8)) -> 500 | F8: 0 | G8: =AS8-AT8 -> 500
A9: 7 | B9: Ken Dacre | C9: 0.79166666666666663 | D9: 0.83125000000000004 | E9: =10*(SUM(E9:N9))+20*(SUM(O9:X9))+30*(SUM(Y9:AH9))+40*(SUM(AI9:AR9)) -> 460 | F9: 0 | G9: =AS9-AT9 -> 460
A10: 8 | B10: Steve Preistley + 2 | C10: 0.7729166666666667 | D10: 0.81458333333333333 | E10: =10*(SUM(E10:N10))+20*(SUM(O10:X10))+30*(SUM(Y10:AH10))+40*(SUM(AI10:AR10)) -> 440 | F10: 0 | G10: =AS10-AT10 -> 440
A11: 9 | B11: Nigel Walker + 1 | C11: 0.76597222222222217 | D11: 0.80763888888888891 | E11: =10*(SUM(E11:N11))+20*(SUM(O11:X11))+30*(SUM(Y11:AH11))+40*(SUM(AI11:AR11)) -> 430 | F11: 0 | G11: =AS11-AT11 -> 430
A12: 10= | B12: Janet Nash | C12: 0.77500000000000002 | D12: 0.81597222222222221 | E12: =10*(SUM(E12:N12))+20*(SUM(O12:X12))+30*(SUM(Y12:AH12))+40*(SUM(AI12:AR12)) -> 380 | F12: 0 | G12: =AS12-AT12 -> 380
A13: 10= | B13: John Nash | C13: 0.77569444444444446 | D13: 0.81874999999999998 | E13: =10*(SUM(E13:N13))+20*(SUM(O13:X13))+30*(SUM(Y13:AH13))+40*(SUM(AI13:AR13)) -> 400 | F13: 20 | G13: =AS13-AT13 -> 380
A14: 12 | B14: Bill Ridings | C14: 0.78333333333333333 | D14: 0.8222222222222223 | E14: =10*(SUM(E14:N14))+20*(SUM(O14:X14))+30*(SUM(Y14:AH14))+40*(SUM(AI14:AR14)) -> 260 | F14: 0 | G14: =AS14-AT14 -> 260
A15: 13 | B15: Andy Williams + 2 | C15: 0.77361111111111114 | D15: 0.8125 | E15: =10*(SUM(E15:N15))+20*(SUM(O15:X15))+30*(SUM(Y15:AH15))+40*(SUM(AI15:AR15)) -> 230 | F15: 0 | G15: =AS15-AT15 -> 230
A16: 14 | B16: Russ Graves | C16: 0.7909722222222223 | D16: 0.83125000000000004 | E16: =10*(SUM(E16:N16))+20*(SUM(O16:X16))+30*(SUM(Y16:AH16))+40*(SUM(AI16:AR16)) -> 220 | F16: 0 | G16: =AS16-AT16 -> 220
B18: 30 mins course
A20: 1 | B20: Jude Onions +1 | E20: =10*(SUM(E20:N20))+20*(SUM(O20:X20))+30*(SUM(Y20:AH20))+40*(SUM(AI20:AR20)) -> 180 | F20: 0 | G20: =AS20-AT20 -> 180

B1: Name | C1: Time Taken | D1: Points | E1: Penalty | F1: Score
B3: 60 mins course
A4: 1 | B4: Louise Sharp + 1 | C4: 60.30 | D4: =10*(SUM(D5:M5))+20*(SUM(N5:W5))+30*(SUM(X5:AG5))+40*(SUM(AH5:AQ5)) -> 650 | E4: 5 | F4: =AR5-AS5 -> 645
A5: 2 | B5: Phil Clark | C5: 56.10 | D5: =10*(SUM(D6:M6))+20*(SUM(N6:W6))+30*(SUM(X6:AG6))+40*(SUM(AH6:AQ6)) -> 580 | E5: 0 | F5: =AR6-AS6 -> 580
A6: 3 | B6: Andrew Walker | C6: 56.27 | D6: =10*(SUM(D7:M7))+20*(SUM(N7:W7))+30*(SUM(X7:AG7))+40*(SUM(AH7:AQ7)) -> 570 | E6: 0 | F6: =AR7-AS7 -> 570
A7: 4 | B7: Paul Ferguson | C7: 68.50 | D7: =10*(SUM(D8:M8))+20*(SUM(N8:W8))+30*(SUM(X8:AG8))+40*(SUM(AH8:AQ8)) -> 650 | E7: 89 | F7: =AR8-AS8 -> 561
A8: 5= | B8: David Neate + 2 | C8: 58.30 | D8: =10*(SUM(D9:M9))+20*(SUM(N9:W9))+30*(SUM(X9:AG9))+40*(SUM(AH9:AQ9)) -> 530 | E8: 0 | F8: =AR9-AS9 -> 530
A9: 5= | B9: Mike Hyde | C9: 57.22 | D9: =10*(SUM(D10:M10))+20*(SUM(N10:W10))+30*(SUM(X10:AG10))+40*(SUM(AH10:AQ10)) -> 530 | E9: 0 | F9: =AR10-AS10 -> 530
A10: 7 | B10: John Nash | C10: 61.05 | D10: =10*(SUM(D11:M11))+20*(SUM(N11:W11))+30*(SUM(X11:AG11))+40*(SUM(AH11:AQ11)) -> 510 | E10: 11 | F10: =AR11-AS11 -> 499
A11: 8 | B11: Jonty Mayo | C11: 58.30 | D11: =10*(SUM(D12:M12))+20*(SUM(N12:W12))+30*(SUM(X12:AG12))+40*(SUM(AH12:AQ12)) -> 490 | E11: 0 | F11: =AR12-AS12 -> 490
A12: 9 | B12: Graham Walkden | C12: 60.10 | D12: =10*(SUM(D13:M13))+20*(SUM(N13:W13))+30*(SUM(X13:AG13))+40*(SUM(AH13:AQ13)) -> 480 | E12: 2 | F12: =AR13-AS13 -> 478
A13: 10= | B13: Sue Owen | C13: 59.58 | D13: =10*(SUM(D14:M14))+20*(SUM(N14:W14))+30*(SUM(X14:AG14))+40*(SUM(AH14:AQ14)) -> 460 | E13: 0 | F13: =AR14-AS14 -> 460
A14: 11 | B14: Jon Broxap | C14: 61.12 | D14: =10*(SUM(D15:M15))+20*(SUM(N15:W15))+30*(SUM(X15:AG15))+40*(SUM(AH15:AQ15)) -> 440 | E14: 12 | F14: =AR15-AS15 -> 428
A15: 12 | B15: Diana Stamp | C15: 57.10 | D15: =10*(SUM(D16:M16))+20*(SUM(N16:W16))+30*(SUM(X16:AG16))+40*(SUM(AH16:AQ16)) -> 410 | E15: 0 | F15: =AR16-AS16 -> 410
A16: 13 | B16: Ken Dacre | C16: 60.30 | D16: =10*(SUM(D17:M17))+20*(SUM(N17:W17))+30*(SUM(X17:AG17))+40*(SUM(AH17:AQ17)) -> 400 | E16: 5 | F16: =AR17-AS17 -> 395
A17: 14 | B17: Richard Moseley +1 | C17: 60.00 | D17: =10*(SUM(D18:M18))+20*(SUM(N18:W18))+30*(SUM(X18:AG18))+40*(SUM(AH18:AQ18)) -> 350 | E17: 0 | F17: =AR18-AS18 -> 350
A18: 15 | B18: Janet Nash | C18: 64.15 | D18: =10*(SUM(D19:M19))+20*(SUM(N19:W19))+30*(SUM(X19:AG19))+40*(SUM(AH19:AQ19)) -> 390 | E18: 43 | F18: =AR19-AS19 -> 347
A19: 16 | B19: Glenys Ferguson | C19: 60.35 | D19: =10*(SUM(D20:M20))+20*(SUM(N20:W20))+30*(SUM(X20:AG20))+40*(SUM(AH20:AQ20)) -> 350 | E19: 6 | F19: =AR20-AS20 -> 344
A20: 17 | B20: Mark Walker + 1 | C20: 61.10 | D20: =10*(SUM(D21:M21))+20*(SUM(N21:W21))+30*(SUM(X21:AG21))+40*(SUM(AH21:AQ21)) -> 350 | E20: 12 | F20: =AR21-AS21 -> 338
A21: 18 | B21: Steve Preistley + 1 | C21: 62.29 | D21: =10*(SUM(D22:M22))+20*(SUM(N22:W22))+30*(SUM(X22:AG22))+40*(SUM(AH22:AQ22)) -> 360 | E21: 25 | F21: =AR22-AS22 -> 335
A22: 19 | B22: Russ Graves | C22: 59.14 | D22: =10*(SUM(D23:M23))+20*(SUM(N23:W23))+30*(SUM(X23:AG23))+40*(SUM(AH23:AQ23)) -> 330 | E22: 0 | F22: =AR23-AS23 -> 330
A23: 20 | B23: Ian Jones | C23: 60.12 | D23: =10*(SUM(D24:M24))+20*(SUM(N24:W24))+30*(SUM(X24:AG24))+40*(SUM(AH24:AQ24)) -> 310 | E23: 2 | F23: =AR24-AS24 -> 308
A24: 21 | B24: Heather Goodman + 1 | C24: 56.40 | D24: =10*(SUM(D25:M25))+20*(SUM(N25:W25))+30*(SUM(X25:AG25))+40*(SUM(AH25:AQ25)) -> 270 | E24: 0 | F24: =AR25-AS25 -> 270
A25: 22 | B25: Nicola Robertson + 1 | C25: 40.24 | D25: =10*(SUM(D26:M26))+20*(SUM(N26:W26))+30*(SUM(X26:AG26))+40*(SUM(AH26:AQ26)) -> 240 | E25: 0 | F25: =AR26-AS26 -> 240
A26: 23 | B26: Diane Walker + 1 | C26: 69.50 | D26: =10*(SUM(D27:M27))+20*(SUM(N27:W27))+30*(SUM(X27:AG27))+40*(SUM(AH27:AQ27)) -> 330 | E26: 99 | F26: =AR27-AS27 -> 231
A27: 24 | B27: Pauline Richardson | C27: 59.25 | D27: =10*(SUM(D28:M28))+20*(SUM(N28:W28))+30*(SUM(X28:AG28))+40*(SUM(AH28:AQ28)) -> 230 | E27: 0 | F27: =AR28-AS28 -> 230

B1: Name | C1: Time Taken | D1: Points | E1: Penalty | F1: Score
B2: 60 mins course
A3: 1 | B3: Louise+ Nick Sharp | C3: 59.36 | D3: =10*(SUM(D4:M4))+20*(SUM(N4:W4))+30*(SUM(X4:AG4))+40*(SUM(AH4:AQ4)) -> 740 | E3: 0 | F3: =AR4-AS4 -> 740
A4: 2 | B4: Phil Clark | C4: 57.09 | D4: =10*(SUM(D5:M5))+20*(SUM(N5:W5))+30*(SUM(X5:AG5))+40*(SUM(AH5:AQ5)) -> 720 | E4: 0 | F4: =AR5-AS5 -> 720
A5: 3 | B5: Paul Ferguson | C5: 58.55 | D5: =10*(SUM(D6:M6))+20*(SUM(N6:W6))+30*(SUM(X6:AG6))+40*(SUM(AH6:AQ6)) -> 690 | E5: 0 | F5: =AR6-AS6 -> 690
A6: 4 | B6: Jonty Mayo | C6: 59.12 | D6: =10*(SUM(D7:M7))+20*(SUM(N7:W7))+30*(SUM(X7:AG7))+40*(SUM(AH7:AQ7)) -> 640 | E6: 0 | F6: =AR7-AS7 -> 640
A7: 5 | B7: Andrew Walker | C7: 60.20 | D7: =10*(SUM(D8:M8))+20*(SUM(N8:W8))+30*(SUM(X8:AG8))+40*(SUM(AH8:AQ8)) -> 630 | E7: 4 | F7: =AR8-AS8 -> 626
A8: 6 | B8: Ken Dacre | C8: 59.00 | D8: =10*(SUM(D9:M9))+20*(SUM(N9:W9))+30*(SUM(X9:AG9))+40*(SUM(AH9:AQ9)) -> 610 | E8: 0 | F8: =AR9-AS9 -> 610
A9: 7 | B9: David Rosen | C9: 59.50 | D9: =10*(SUM(D10:M10))+20*(SUM(N10:W10))+30*(SUM(X10:AG10))+40*(SUM(AH10:AQ10)) -> 590 | E9: 0 | F9: =AR10-AS10 -> 590
A10: 8 | B10: Jon Broxap | C10: 61.00 | D10: =10*(SUM(D11:M11))+20*(SUM(N11:W11))+30*(SUM(X11:AG11))+40*(SUM(AH11:AQ11)) -> 580 | E10: 10 | F10: =AR11-AS11 -> 570
A11: 9 | B11: Mike Hyde | C11: 55.43 | D11: =10*(SUM(D12:M12))+20*(SUM(N12:W12))+30*(SUM(X12:AG12))+40*(SUM(AH12:AQ12)) -> 540 | E11: 0 | F11: =AR12-AS12 -> 540
A12: 10= | B12: David Neate + 1 | C12: 61.40 | D12: =10*(SUM(D13:M13))+20*(SUM(N13:W13))+30*(SUM(X13:AG13))+40*(SUM(AH13:AQ13)) -> 540 | E12: 17 | F12: =AR13-AS13 -> 523
A13: 10= | B13: Diane Walker + 1 | C13: 60.40 | D13: =10*(SUM(D14:M14))+20*(SUM(N14:W14))+30*(SUM(X14:AG14))+40*(SUM(AH14:AQ14)) -> 530 | E13: 7 | F13: =AR14-AS14 -> 523
A14: 12= | B14: John Bagge | C14: 57.10 | D14: =10*(SUM(D15:M15))+20*(SUM(N15:W15))+30*(SUM(X15:AG15))+40*(SUM(AH15:AQ15)) -> 520 | E14: 0 | F14: =AR15-AS15 -> 520
A15: 12= | B15: Steve Preistley + 2 | C15: 58.10 | D15: =10*(SUM(D16:M16))+20*(SUM(N16:W16))+30*(SUM(X16:AG16))+40*(SUM(AH16:AQ16)) -> 520 | E15: 0 | F15: =AR16-AS16 -> 520
A16: 14 | B16: David Mainwaring + Dan | C16: 59.50 | D16: =10*(SUM(D17:M17))+20*(SUM(N17:W17))+30*(SUM(X17:AG17))+40*(SUM(AH17:AQ17)) -> 510 | E16: 0 | F16: =AR17-AS17 -> 510
A17: 15 | B17: Graham Walkden | C17: 56.45 | D17: =10*(SUM(D18:M18))+20*(SUM(N18:W18))+30*(SUM(X18:AG18))+40*(SUM(AH18:AQ18)) -> 480 | E17: 0 | F17: =AR18-AS18 -> 480
A18: 16 | B18: Glenys Ferguson | C18: 60.17 | D18: =10*(SUM(D19:M19))+20*(SUM(N19:W19))+30*(SUM(X19:AG19))+40*(SUM(AH19:AQ19)) -> 480 | E18: 3 | F18: =AR19-AS19 -> 477
A19: 17 | B19: Janet Nash | C19: 58.30 | D19: =10*(SUM(D20:M20))+20*(SUM(N20:W20))+30*(SUM(X20:AG20))+40*(SUM(AH20:AQ20)) -> 470 | E19: 0 | F19: =AR20-AS20 -> 470
A20: 18= | B20: Helen + Marion | C20: 57.54 | D20: =10*(SUM(D21:M21))+20*(SUM(N21:W21))+30*(SUM(X21:AG21))+40*(SUM(AH21:AQ21)) -> 450 | E20: 0 | F20: =AR21-AS21 -> 450
A21: 18= | B21: Tony Richardson | C21: 51.30 | D21: =10*(SUM(D22:M22))+20*(SUM(N22:W22))+30*(SUM(X22:AG22))+40*(SUM(AH22:AQ22)) -> 450 | E21: 0 | F21: =AR22-AS22 -> 450
A22: 20 | B22: Andrew Wilson + 1 | C22: 56.39 | D22: =10*(SUM(D23:M23))+20*(SUM(N23:W23))+30*(SUM(X23:AG23))+40*(SUM(AH23:AQ23)) -> 440 | E22: 0 | F22: =AR23-AS23 -> 440
A23: 21= | B23: Sue Owen | C23: 59.15 | D23: =10*(SUM(D24:M24))+20*(SUM(N24:W24))+30*(SUM(X24:AG24))+40*(SUM(AH24:AQ24)) -> 420 | E23: 0 | F23: =AR24-AS24 -> 420
A24: 21= | B24: Tony Rockey+ John Taylor | C24: 57.20 | D24: =10*(SUM(D25:M25))+20*(SUM(N25:W25))+30*(SUM(X25:AG25))+40*(SUM(AH25:AQ25)) -> 420 | E24: 0 | F24: =AR25-AS25 -> 420
A25: 23 | B25: Pauline Richardson | C25: 63.00 | D25: =10*(SUM(D26:M26))+20*(SUM(N26:W26))+30*(SUM(X26:AG26))+40*(SUM(AH26:AQ26)) -> 440 | E25: 30 | F25: =AR26-AS26 -> 410
A26: 24 | B26: Russ Graves | C26: 59.35 | D26: =10*(SUM(D27:M27))+20*(SUM(N27:W27))+30*(SUM(X27:AG27))+40*(SUM(AH27:AQ27)) -> 380 | E26: 0 | F26: =AR27-AS27 -> 380
A27: 25= | B27: Diana Stamp | C27: 57.43 | D27: =10*(SUM(D28:M28))+20*(SUM(N28:W28))+30*(SUM(X28:AG28))+40*(SUM(AH28:AQ28)) -> 370 | E27: 0 | F27: =AR28-AS28 -> 370
A28: 25= | B28: Mark Walker + Jude+ Nicola | C28: 59.04 | D28: =10*(SUM(D29:M29))+20*(SUM(N29:W29))+30*(SUM(X29:AG29))+40*(SUM(AH29:AQ29)) -> 370 | E28: 0 | F28: =AR29-AS29 -> 370
A29: 27 | B29: Paul Williams | C29: 58.11 | D29: =10*(SUM(D30:M30))+20*(SUM(N30:W30))+30*(SUM(X30:AG30))+40*(SUM(AH30:AQ30)) -> 340 | E29: 0 | F29: =AR30-AS30 -> 340
A30: 28 | B30: Terressa + Rachel | C30: 58.30 | D30: =10*(SUM(D31:M31))+20*(SUM(N31:W31))+30*(SUM(X31:AG31))+40*(SUM(AH31:AQ31)) -> 310 | E30: 0 | F30: =AR31-AS31 -> 310
A31: 29 | B31: Chris Rowley | C31: 51.48 | D31: =10*(SUM(D32:M32))+20*(SUM(N32:W32))+30*(SUM(X32:AG32))+40*(SUM(AH32:AQ32)) -> 300 | E31: 0 | F31: =AR32-AS32 -> 300
A32: 30 | B32: Ian Cole + Emily | C32: 40.05 | D32: =10*(SUM(D33:M33))+20*(SUM(N33:W33))+30*(SUM(X33:AG33))+40*(SUM(AH33:AQ33)) -> 180 | E32: 0 | F32: =AR33-AS33 -> 180
A33: 31 | B33: The Richards Family | C33: 56.34 | D33: =10*(SUM(D34:M34))+20*(SUM(N34:W34))+30*(SUM(X34:AG34))+40*(SUM(AH34:AQ34)) -> 100 | E33: 0 | F33: =AR34-AS34 -> 100