D1: Points | E1: Time | F1: Time | G1: Adjusted
B2: Name | C2: Class | D2: Scored | E2: Taken | F2: Penalties | G2: Score
A4: 1 | B4: Nick & Louise Sharp | C4: 60 mins | D4: 1000 | E4: 58.38 | F4: 0 | G4: =D4-F4 -> 1000
A5: 2 | B5: Phil Clarke | C5: 60 mins | D5: 920 | E5: 54.35 | F5: 0 | G5: =D5-F5 -> 920
A6: 3 | B6: Martin Weeks | C6: 60 mins | D6: 900 | E6: 61.55 | F6: 23 | G6: =D6-F6 -> 877
A7: 4 | B7: Rigby Jerram | C7: 60 mins | D7: 870 | E7: 56.17 | F7: 0 | G7: =D7-F7 -> 870
A8: 5 | B8: Jonty Mayo & Sharon Taylor | C8: 60 mins | D8: 870 | E8: 60.00 | F8: 0 | G8: =D8-F8 -> 870
A9: 6 | B9: Chris Speight | C9: 60 mins | D9: 810 | E9: 60.10 | F9: 2 | G9: =D9-F9 -> 808
A10: 7 | B10: Graham Walkden | C10: 60 mins | D10: 770 | E10: 60.08 | F10: 2 | G10: =D10-F10 -> 768
A11: 8 | B11: Mike Hind | C11: 60 mins | D11: 760 | E11: 56.50 | F11: 0 | G11: =D11-F11 -> 760
A12: 9 | B12: David Downes | C12: 60 mins | D12: 760 | E12: 58.40 | F12: 0 | G12: =D12-F12 -> 760 | H12: Bike
A13: 10 | B13: Janet Nash | C13: 60 mins | D13: 740 | E13: 59.20 | F13: 0 | G13: =D13-F13 -> 740
A14: 11 | B14: Paul Gibling | C14: 60 mins | D14: 720 | E14: 60.50 | F14: 10 | G14: =D14-F14 -> 710
A15: 12 | B15: Sue Owen | C15: 60 mins | D15: 690 | E15: 59.15 | F15: 0 | G15: =D15-F15 -> 690
A16: 13 | B16: Tony Richardson | C16: 60 mins | D16: 700 | E16: 60.55 | F16: 11 | G16: =D16-F16 -> 689
A17: 14 | B17: Diane & Nigel Walker | C17: 60 mins | D17: 710 | E17: 62.25 | F17: 29 | G17: =D17-F17 -> 681
A18: 15 | B18: John Nash | C18: 60 mins | D18: 660 | E18: 58.42 | F18: 0 | G18: =D18-F18 -> 660
A19: 16 | B19: Steve Preistly + Christine | C19: 60 mins | D19: 660 | E19: 60.28 | F19: 6 | G19: =D19-F19 -> 654
A20: 17 | B20: Marion & Helen | C20: 60 mins | D20: 590 | E20: 54.45 | F20: 0 | G20: =D20-F20 -> 590
A21: 18 | B21: Heather Goodman | C21: 60 mins | D21: 570 | E21: 60.13 | F21: 3 | G21: =D21-F21 -> 567
A22: 19 | B22: Diana Stamp | C22: 60 mins | D22: 560 | E22: 58.15 | F22: 0 | G22: =D22-F22 -> 560
A23: 20 | B23: Phil Whitehurst | C23: 60 mins | D23: 550 | E23: 59.40 | F23: 0 | G23: =D23-F23 -> 550
A24: 21 | B24: Richard Day | C24: 60 mins | D24: 520 | E24: 58.50 | F24: 0 | G24: =D24-F24 -> 520
A25: 22 | B25: Pauline Richardson | C25: 60 mins | D25: 510 | E25: 59.30 | F25: 0 | G25: =D25-F25 -> 510
A26: 23 | B26: David Mannering | C26: 30 mins | D26: 500 | E26: 29.35 | F26: 0 | G26: =D26-F26 -> 500
A27: 24 | B27: Rob Marriott | C27: 60 mins | D27: 500 | E27: 53.35 | F27: 0 | G27: =D27-F27 -> 500
A28: 25 | B28: Emily Neate | C28: 60 mins | D28: 490 | E28: 53.45 | F28: 0 | G28: =D28-F28 -> 490 | H28: Junior
A29: 26 | B29: Charlotte Webb | C29: 60 mins | D29: 540 | E29: 65.16 | F29: 64 | G29: =D29-F29 -> 476
A30: 27 | B30: Thomas & Laura Chaldecott | C30: 60 mins | D30: 530 | E30: 64.50 | F30: 58 | G30: =D30-F30 -> 472 | H30: Junior
A31: 28 | B31: Neate Family | C31: 30 mins | D31: 280 | E31: 33.00 | F31: 36 | G31: =D31-F31 -> 244 | H31: Junior
A32: 29 | B32: James Allison | C32: 30 mins | D32: 230 | E32: 28.45 | F32: 0 | G32: =D32-F32 -> 230 | H32: Junior