B3: Kendal Street O series 2002
B4: Combined League Table based on Average scoring rate per minute
F5: Event One | H5: Event Two | J5: Event Three | L5: Event Four | N5: Total | P5: Average | Q5: Average
F6: Adjusted | G6: Time | H6: Adjusted | I6: Time | J6: Adjusted | K6: Time | L6: Adjusted | M6: Time | N6: Adjusted | O6: Time | P6: Scoring | Q6: Score
C7: Name | D7: Class | E7: Category | F7: Score | G7: Taken | H7: Score | I7: Taken | J7: Score | K7: Taken | L7: Score | M7: Taken | N7: Score | O7: Taken | P7: Rate Pts/min | Q7: Per Event
B9: 1 | C9: Derek Fryer | D9: 60 mins | E9: Male | F9: 0 | H9: 880 | I9: 58.51 | J9: 0 | L9: 1248 | M9: 65.10 | N9: =H9+J9+L9+N9 -> 2128 | O9: =I9+K9+M9+O9 -> 123.61 | P9: =P9/Q9 -> 17.215435644365346 | Q9: =P9/2 -> 1064.0
B10: 2 | C10: Jonty Mayo | D10: 60 mins | E10: Male | F10: 0 | H10: 880 | I10: 55.08 | J10: 0 | L10: 1070 | M10: 58.44 | N10: =H10+J10+L10+N10 -> 1950 | O10: =I10+K10+M10+O10 -> 113.52 | P10: =P10/Q10 -> 17.177589852008456 | Q10: =P10/2 -> 975.0
B11: 3 | C11: Nick & Louise Sharp | D11: 60 mins | E11: Pairs | F11: 1000 | G11: 58.38 | H11: 0 | J11: 0 | L11: 0 | N11: =H11+J11+L11+N11 -> 1000 | O11: =I11+K11+M11+O11 -> 58.38 | P11: =P11/Q11 -> 17.129153819801299 | Q11: =P11/1 -> 1000.0
B12: 4 | C12: Phil Clarke | D12: 60 mins | E12: Male | F12: 920 | G12: 54.35 | H12: 1058 | I12: 60.10 | J12: 810 | K12: 60.00 | L12: 1140 | M12: 57.44 | N12: =H12+J12+L12+N12 -> 3928 | O12: =I12+K12+M12+O12 -> 231.89 | P12: =P12/Q12 -> 16.93906593643538 | Q12: =P12/4 -> 982.0
B13: 5 | C13: David Mannering | D13: 60 mins | E13: Male | F13: 500 | G13: 29.35 | H13: 860 | I13: 57.25 | J13: 0 | L13: 0 | N13: =H13+J13+L13+N13 -> 1360 | O13: =I13+K13+M13+O13 -> 86.60 | P13: =P13/Q13 -> 15.704387990762125 | Q13: =P13/2 -> 680.0
B14: 6 | C14: Rigby Jerram | D14: 60 mins | E14: Male | F14: 870 | G14: 56.17 | H14: 0 | J14: 0 | L14: 0 | N14: =H14+J14+L14+N14 -> 870 | O14: =I14+K14+M14+O14 -> 56.17 | P14: =P14/Q14 -> 15.48869503293573 | Q14: =P14/1 -> 870.0
B15: 7 | C15: George Robertson | D15: 60 mins | E15: Male | F15: 0 | H15: 0 | J15: 900 | K15: 59.10 | L15: 0 | N15: =H15+J15+L15+N15 -> 900 | O15: =I15+K15+M15+O15 -> 59.10 | P15: =P15/Q15 -> 15.228426395939087 | Q15: =P15/1 -> 900.0
B16: 8 | C16: David Downes | D16: 60 mins | E16: Biker | F16: 760 | G16: 58.40 | H16: 0 | J16: 630 | K16: 57.35 | L16: 1120 | M16: 59.23 | N16: =H16+J16+L16+N16 -> 2510 | O16: =I16+K16+M16+O16 -> 174.98 | P16: =P16/Q16 -> 14.344496513887302 | Q16: =P16/3 -> 836.66666666666663
B17: 9 | C17: Paul Ferguson | D17: 60 mins | E17: Male | F17: 0 | H17: 1029 | I17: 65.04 | J17: 848 | K17: 66.00 | L17: 0 | N17: =H17+J17+L17+N17 -> 1877 | O17: =I17+K17+M17+O17 -> 131.04 | P17: =P17/Q17 -> 14.323870573870572 | Q17: =P17/2 -> 938.5
B18: 10 | C18: Chris Speight | D18: 60 mins | E18: Male | F18: 808 | G18: 60.10 | H18: 0 | J18: 0 | L18: 0 | N18: =H18+J18+L18+N18 -> 808 | O18: =I18+K18+M18+O18 -> 60.10 | P18: =P18/Q18 -> 13.444259567387688 | Q18: =P18/1 -> 808.0
B19: 11 | C19: Mike Hyde | D19: 60 mins | E19: Male | F19: 760 | G19: 56.50 | H19: 760 | I19: 56.21 | J19: 598 | K19: 61.46 | L19: 900 | M19: 55.15 | N19: =H19+J19+L19+N19 -> 3018 | O19: =I19+K19+M19+O19 -> 229.32 | P19: =P19/Q19 -> 13.160648874934587 | Q19: =P19/4 -> 754.5
B20: 12 | C20: Martin Weeks | D20: 60 mins | E20: Male | F20: 877 | G20: 61.55 | H20: 821 | I20: 69.02 | J20: 620 | K20: 59.20 | L20: 1033 | M20: 68.04 | N20: =H20+J20+L20+N20 -> 3351 | O20: =I20+K20+M20+O20 -> 257.81 | P20: =P20/Q20 -> 12.99794422248943 | Q20: =P20/4 -> 837.75
B21: 13 | C21: Gill & Roger Chaldecott | D21: 60 mins | E21: Pairs | L21: 779 | M21: 60.50 | N21: =H21+J21+L21+N21 -> 779 | O21: =I21+K21+M21+O21 -> 60.50 | P21: =P21/Q21 -> 12.87603305785124 | Q21: =P21/1 -> 779.0
B22: 14 | C22: Graham Walkden | D22: 60 mins | E22: Male | F22: 768 | G22: 60.08 | H22: 0 | J22: 0 | L22: 0 | N22: =H22+J22+L22+N22 -> 768 | O22: =I22+K22+M22+O22 -> 60.08 | P22: =P22/Q22 -> 12.78295605858855 | Q22: =P22/1 -> 768.0
B23: 15 | C23: Debbie Thomson | D23: 60 mins | E23: Female | F23: 0 | H23: 740 | I23: 59.20 | J23: 580 | K23: 58.00 | L23: 932 | M23: 60.20 | N23: =H23+J23+L23+N23 -> 2252 | O23: =I23+K23+M23+O23 -> 177.40 | P23: =P23/Q23 -> 12.694475760992107 | Q23: =P23/3 -> 750.66666666666663
B24: 16 | C24: Simon Maytum | D24: 60 mins | E24: Male | F24: 0 | H24: 744 | I24: 60.29 | J24: 0 | L24: 0 | N24: =H24+J24+L24+N24 -> 744 | O24: =I24+K24+M24+O24 -> 60.29 | P24: =P24/Q24 -> 12.340354951069829 | Q24: =P24/1 -> 744.0
B25: 17 | C25: Jonty Mayo & Sharon Taylor | D25: 60 mins | E25: Pairs | F25: 870 | G25: 60.00 | H25: 0 | J25: 500 | K25: 53.00 | L25: 0 | N25: =H25+J25+L25+N25 -> 1370 | O25: =I25+K25+M25+O25 -> 113.00 | P25: =P25/Q25 -> 12.123893805309734 | Q25: =P25/2 -> 685.0
B26: 18 | C26: Diane & Nigel Walker | D26: 60 mins | E26: Pairs | F26: 681 | G26: 62.25 | H26: 730 | I26: 58.14 | J26: 518 | K26: 61.48 | L26: 967 | M26: 60.11 | N26: =H26+J26+L26+N26 -> 2896 | O26: =I26+K26+M26+O26 -> 241.98 | P26: =P26/Q26 -> 11.967931233986279 | Q26: =P26/4 -> 724.0
B27: 19 | C27: Paul Gibling | D27: 60 mins | E27: Male | F27: 710 | G27: 60.50 | H27: 0 | J27: 0 | L27: 0 | N27: =H27+J27+L27+N27 -> 710 | O27: =I27+K27+M27+O27 -> 60.50 | P27: =P27/Q27 -> 11.735537190082646 | Q27: =P27/1 -> 710.0
B28: 20 | C28: Steve Preistly + Christine | D28: 60 mins | E28: Pairs | F28: 654 | G28: 60.28 | H28: 730 | I28: 58.16 | J28: 0 | L28: 0 | N28: =H28+J28+L28+N28 -> 1384 | O28: =I28+K28+M28+O28 -> 118.44 | P28: =P28/Q28 -> 11.685241472475516 | Q28: =P28/2 -> 692.0
B29: 21 | C29: John Nash | D29: 60 mins | E29: Male | F29: 660 | G29: 58.42 | H29: 726 | I29: 60.20 | J29: 538 | K29: 62.40 | L29: 880 | M29: 59.00 | N29: =H29+J29+L29+N29 -> 2804 | O29: =I29+K29+M29+O29 -> 240.02 | P29: =P29/Q29 -> 11.682359803349721 | Q29: =P29/4 -> 701.0
B30: 22 | C30: Nick Mortimer | D30: 30 mins | E30: Biker | F30: 0 | H30: 310 | I30: 27.04 | J30: 0 | L30: 0 | N30: =H30+J30+L30+N30 -> 310 | O30: =I30+K30+M30+O30 -> 27.04 | P30: =P30/Q30 -> 11.464497041420119 | Q30: =P30/1 -> 310.0
B31: 23 | C31: Tony Richardson | D31: 60 mins | E31: Male | F31: 689 | G31: 60.55 | H31: 0 | J31: 0 | L31: 0 | N31: =H31+J31+L31+N31 -> 689 | O31: =I31+K31+M31+O31 -> 60.55 | P31: =P31/Q31 -> 11.379025598678778 | Q31: =P31/1 -> 689.0
B32: 24 | C32: Loz Colyer | D32: 60mins | E32: Male | F32: 0 | H32: 0 | J32: 630 | K32: 60.00 | L32: 908 | M32: 76.00 | N32: =H32+J32+L32+N32 -> 1538 | O32: =I32+K32+M32+O32 -> 136.00 | P32: =P32/Q32 -> 11.308823529411764 | Q32: =P32/2 -> 769.0
B33: 25 | C33: Matt Foxwell | D33: 60 mins | E33: Male | F33: 0 | H33: 510 | I33: 57.12 | J33: 200 | K33: 27.24 | L33: 880 | M33: 56.25 | N33: =H33+J33+L33+N33 -> 1590 | O33: =I33+K33+M33+O33 -> 140.61 | P33: =P33/Q33 -> 11.307872839769574 | Q33: =P33/3 -> 530.0
B34: 26 | C34: Janet Nash | D34: 60 mins | E34: Female | F34: 740 | G34: 59.20 | H34: 703 | I34: 65.35 | J34: 470 | K34: 59.10 | L34: 820 | M34: 59.28 | N34: =H34+J34+L34+N34 -> 2733 | O34: =I34+K34+M34+O34 -> 242.93 | P34: =P34/Q34 -> 11.250154365455069 | Q34: =P34/4 -> 683.25
B35: 27 | C35: Sue Owen | D35: 60 mins | E35: Female | F35: 690 | G35: 59.15 | H35: 792 | I35: 60.36 | J35: 539 | K35: 62.31 | L35: 0 | N35: =H35+J35+L35+N35 -> 2021 | O35: =I35+K35+M35+O35 -> 181.82 | P35: =P35/Q35 -> 11.115388846111539 | Q35: =P35/3 -> 673.66666666666663
B36: 28 | C36: Gareth Thomas | D36: 60 mins | E36: Male | F36: 0 | H36: 694 | I36: 63.49 | J36: 0 | L36: 0 | N36: =H36+J36+L36+N36 -> 694 | O36: =I36+K36+M36+O36 -> 63.49 | P36: =P36/Q36 -> 10.930855252795716 | Q36: =P36/1 -> 694.0
B37: 29 | C37: Marion & Helen | D37: 60 mins | E37: Pairs | F37: 590 | G37: 54.45 | H37: 0 | J37: 0 | L37: 0 | N37: =H37+J37+L37+N37 -> 590 | O37: =I37+K37+M37+O37 -> 54.45 | P37: =P37/Q37 -> 10.835629017447198 | Q37: =P37/1 -> 590.0
B38: 30 | C38: Diana Stamp | D38: 60 mins | E38: Female | F38: 560 | G38: 58.15 | H38: 620 | I38: 57.31 | J38: 470 | K38: 59.48 | L38: 722 | M38: 60.40 | N38: =H38+J38+L38+N38 -> 2372 | O38: =I38+K38+M38+O38 -> 235.34 | P38: =P38/Q38 -> 10.07903458825529 | Q38: =P38/4 -> 593.0
B39: 31 | C39: Stewart Allison | D39: 30 mins | E39: Junior | L39: 270 | M39: 27.15 | N39: =H39+J39+L39+N39 -> 270 | O39: =I39+K39+M39+O39 -> 27.15 | P39: =P39/Q39 -> 9.94475138121547 | Q39: =P39/1 -> 270.0
B40: 32 | C40: Glenis Ferguson | D40: 60 mins | E40: Female | F40: 0 | H40: 650 | I40: 57.27 | J40: 500 | K40: 60.00 | L40: 0 | N40: =H40+J40+L40+N40 -> 1150 | O40: =I40+K40+M40+O40 -> 117.27 | P40: =P40/Q40 -> 9.8064296068900827 | Q40: =P40/2 -> 575.0
B41: 33 | C41: Heather, Diane + Rachel | D41: 60 mins | E41: Pairs | F41: 567 | G41: 60.13 | H41: 590 | I41: 58.43 | J41: 0 | L41: 0 | N41: =H41+J41+L41+N41 -> 1157 | O41: =I41+K41+M41+O41 -> 118.56 | P41: =P41/Q41 -> 9.7587719298245617 | Q41: =P41/2 -> 578.5
B42: 34 | C42: James Allison | D42: 30 mins | E42: Junior | F42: 230 | G42: 28.45 | H42: 0 | J42: 0 | L42: 330 | M42: 30.04 | N42: =H42+J42+L42+N42 -> 560 | O42: =I42+K42+M42+O42 -> 58.49 | P42: =P42/Q42 -> 9.5742862027697058 | Q42: =P42/2 -> 280.0
B43: 35 | C43: Pauline Richardson | D43: 60 mins | E43: Female | F43: 510 | G43: 59.30 | H43: 574 | I43: 63.00 | J43: 0 | L43: 640 | M43: 58.00 | N43: =H43+J43+L43+N43 -> 1724 | O43: =I43+K43+M43+O43 -> 180.30 | P43: =P43/Q43 -> 9.5618413754853009 | Q43: =P43/3 -> 574.66666666666663
B44: 36 | C44: Rob Marriott | D44: 60 mins | E44: Male | F44: 500 | G44: 53.35 | H44: 0 | J44: 0 | L44: 0 | N44: =H44+J44+L44+N44 -> 500 | O44: =I44+K44+M44+O44 -> 53.35 | P44: =P44/Q44 -> 9.3720712277413298 | Q44: =P44/1 -> 500.0
B45: 37 | C45: Phil Whitehurst | D45: 60 mins | E45: Male | F45: 550 | G45: 59.40 | H45: 0 | J45: 0 | L45: 0 | N45: =H45+J45+L45+N45 -> 550 | O45: =I45+K45+M45+O45 -> 59.40 | P45: =P45/Q45 -> 9.2592592592592595 | Q45: =P45/1 -> 550.0
B46: 38 | C46: Emily Neate | D46: 60 mins | E46: Junior | F46: 490 | G46: 53.45 | H46: 0 | J46: 0 | L46: 0 | N46: =H46+J46+L46+N46 -> 490 | O46: =I46+K46+M46+O46 -> 53.45 | P46: =P46/Q46 -> 9.1674462114125355 | Q46: =P46/1 -> 490.0
B47: 39 | C47: Richard Day | D47: 60 mins | E47: Male | F47: 520 | G47: 58.50 | H47: 0 | J47: 0 | L47: 0 | N47: =H47+J47+L47+N47 -> 520 | O47: =I47+K47+M47+O47 -> 58.50 | P47: =P47/Q47 -> 8.8888888888888893 | Q47: =P47/1 -> 520.0
B48: 40 | C48: David Neate | D48: 60 mins | E48: Male | F48: 0 | H48: 268 | I48: 30.10 | J48: 0 | L48: 520 | M48: 60.00 | N48: =H48+J48+L48+N48 -> 788 | O48: =I48+K48+M48+O48 -> 90.10 | P48: =P48/Q48 -> 8.745837957824639 | Q48: =P48/2 -> 394.0
B49: 41 | C49: Thomas & Laura Chaldecott | D49: 60 mins | E49: Junior | F49: 472 | G49: 64.50 | H49: 560 | I49: 57.25 | J49: 290 | K49: 53.41 | L49: 610 | M49: 57.40 | N49: =H49+J49+L49+N49 -> 1932 | O49: =I49+K49+M49+O49 -> 232.56 | P49: =P49/Q49 -> 8.3075335397316827 | Q49: =P49/4 -> 483.0
B50: 42 | C50: Heather Meek | D50: 60 mins | E50: Biker | F50: 0 | H50: 490 | I50: 61.40 | J50: 0 | L50: 0 | N50: =H50+J50+L50+N50 -> 490 | O50: =I50+K50+M50+O50 -> 61.40 | P50: =P50/Q50 -> 7.9804560260586319 | Q50: =P50/1 -> 490.0
B51: 43 | C51: Neate Family | D51: 30 mins | E51: Junior | F51: 244 | G51: 33.00 | H51: 0 | J51: 0 | L51: 0 | N51: =H51+J51+L51+N51 -> 244 | O51: =I51+K51+M51+O51 -> 33.00 | P51: =P51/Q51 -> 7.3939393939393936 | Q51: =P51/1 -> 244.0
B52: 44 | C52: David Wolfendale | D52: 60 mins | E52: Male | F52: 0 | H52: 0 | J52: 390 | K52: 53.39 | L52: 0 | N52: =H52+J52+L52+N52 -> 390 | O52: =I52+K52+M52+O52 -> 53.39 | P52: =P52/Q52 -> 7.3047387151151897 | Q52: =P52/1 -> 390.0
B53: 45 | C53: Karl, Danny, Darren | D53: 60 mins | E53: Junior | F53: 0 | H53: 0 | J53: 260 | K53: 38.40 | L53: 0 | N53: =H53+J53+L53+N53 -> 260 | O53: =I53+K53+M53+O53 -> 38.40 | P53: =P53/Q53 -> 6.7708333333333339 | Q53: =P53/1 -> 260.0
B54: 46 | C54: Sarah Fulwood | D54: 60 mins | E54: Female | F54: 0 | H54: 0 | J54: 230 | K54: 34.16 | L54: 0 | N54: =H54+J54+L54+N54 -> 230 | O54: =I54+K54+M54+O54 -> 34.16 | P54: =P54/Q54 -> 6.7330210772833734 | Q54: =P54/1 -> 230.0
B55: 47 | C55: Charlotte Webb | D55: 60 mins | E55: Female | F55: 476 | G55: 65.16 | H55: 244 | I55: 62.58 | J55: 380 | K55: 51.15 | L55: 0 | N55: =H55+J55+L55+N55 -> 1100 | O55: =I55+K55+M55+O55 -> 178.89 | P55: =P55/Q55 -> 6.1490301302476391 | Q55: =P55/2 -> 550.0
B56: 48 | C56: Anne David | D56: 60 mins | E56: Biker | F56: 0 | H56: 464 | I56: 88.00 | J56: 0 | L56: 0 | N56: =H56+J56+L56+N56 -> 464 | O56: =I56+K56+M56+O56 -> 88.00 | P56: =P56/Q56 -> 5.2727272727272725 | Q56: =P56/1 -> 464.0

B3: Category League Tables
F4: Event One | H4: Event Two | J4: Event Three | L4: Event Four | N4: Total | P4: Average | Q4: Average
F5: Adjusted | G5: Time | H5: Adjusted | I5: Time | J5: Adjusted | K5: Time | L5: Adjusted | M5: Time | N5: Adjusted | O5: Time | P5: Scoring | Q5: Score
C6: Name | D6: Class | E6: Category | F6: Score | G6: Taken | H6: Score | I6: Taken | J6: Score | K6: Taken | L6: Score | M6: Taken | N6: Score | O6: Taken | P6: Rate Pts/min | Q6: Per Event
B8: 1 | C8: Diane & Nigel Walker | D8: 60 mins | E8: Pairs | F8: 681 | G8: 62.25 | H8: 730 | I8: 58.14 | J8: 518 | K8: 61.48 | L8: 967 | M8: 60.11 | N8: =H9+J9+L9+N9 -> 2896 | O8: =I9+K9+M9+O9 -> 241.98 | P8: =P9/Q9 -> 11.967931233986279 | Q8: =P9/4 -> 724.0
B9: 2 | C9: Steve Preistly + Christine | D9: 60 mins | E9: Pairs | F9: 654 | G9: 60.28 | H9: 730 | I9: 58.16 | J9: 0 | L9: 0 | N9: =H10+J10+L10+N10 -> 1384 | O9: =I10+K10+M10+O10 -> 118.44 | P9: =P10/Q10 -> 11.685241472475516 | Q9: =P10/2 -> 692.0
B10: 3 | C10: Jonty Mayo & Sharon Taylor | D10: 60 mins | E10: Pairs | F10: 870 | G10: 60.00 | H10: 0 | J10: 500 | K10: 53.00 | L10: 0 | N10: =H11+J11+L11+N11 -> 1370 | O10: =I11+K11+M11+O11 -> 113.00 | P10: =P11/Q11 -> 12.123893805309734 | Q10: =P11/2 -> 685.0
B11: 4 | C11: Heather, Diane + Rachel | D11: 60 mins | E11: Pairs | F11: 567 | G11: 60.13 | H11: 590 | I11: 58.43 | J11: 0 | L11: 0 | N11: =H12+J12+L12+N12 -> 1157 | O11: =I12+K12+M12+O12 -> 118.56 | P11: =P12/Q12 -> 9.7587719298245617 | Q11: =P12/2 -> 578.5
B12: 5 | C12: Nick & Louise Sharp | D12: 60 mins | E12: Pairs | F12: 1000 | G12: 58.38 | H12: 0 | J12: 0 | L12: 0 | N12: =H13+J13+L13+N13 -> 1000 | O12: =I13+K13+M13+O13 -> 58.38 | P12: =P13/Q13 -> 17.129153819801299 | Q12: =P13/1 -> 1000.0
B13: 6 | C13: Gill & Roger Chaldecott | D13: 60 mins | E13: Pairs | L13: 779 | M13: 60.50 | N13: =H14+J14+L14+N14 -> 779 | O13: =I14+K14+M14+O14 -> 60.50 | P13: =P14/Q14 -> 12.87603305785124 | Q13: =P14/1 -> 779.0
B14: 7 | C14: Marion & Helen | D14: 60 mins | E14: Pairs | F14: 590 | G14: 54.45 | H14: 0 | J14: 0 | L14: 0 | N14: =H15+J15+L15+N15 -> 590 | O14: =I15+K15+M15+O15 -> 54.45 | P14: =P15/Q15 -> 10.835629017447198 | Q14: =P15/1 -> 590.0
B16: 1 | C16: Phil Clarke | D16: 60 mins | E16: Male | F16: 920 | G16: 54.35 | H16: 1058 | I16: 60.10 | J16: 810 | K16: 60.00 | L16: 1140 | M16: 57.44 | N16: =H16+J16+L16+N16 -> 3928 | O16: =I16+K16+M16+O16 -> 231.89 | P16: =P16/Q16 -> 16.93906593643538 | Q16: =P16/4 -> 982.0
B17: 2 | C17: Martin Weeks | D17: 60 mins | E17: Male | F17: 877 | G17: 61.55 | H17: 821 | I17: 69.02 | J17: 620 | K17: 59.20 | L17: 1033 | M17: 68.04 | N17: =H17+J17+L17+N17 -> 3351 | O17: =I17+K17+M17+O17 -> 257.81 | P17: =P17/Q17 -> 12.99794422248943 | Q17: =P17/4 -> 837.75
B18: 3 | C18: Mike Hyde | D18: 60 mins | E18: Male | F18: 760 | G18: 56.50 | H18: 760 | I18: 56.21 | J18: 598 | K18: 61.46 | L18: 900 | M18: 55.15 | N18: =H18+J18+L18+N18 -> 3018 | O18: =I18+K18+M18+O18 -> 229.32 | P18: =P18/Q18 -> 13.160648874934587 | Q18: =P18/4 -> 754.5
B19: 4 | C19: John Nash | D19: 60 mins | E19: Male | F19: 660 | G19: 58.42 | H19: 726 | I19: 60.20 | J19: 538 | K19: 62.40 | L19: 880 | M19: 59.00 | N19: =H19+J19+L19+N19 -> 2804 | O19: =I19+K19+M19+O19 -> 240.02 | P19: =P19/Q19 -> 11.682359803349721 | Q19: =P19/4 -> 701.0
B20: 5 | C20: Derek Fryer | D20: 60 mins | E20: Male | F20: 0 | H20: 880 | I20: 58.51 | J20: 0 | L20: 1248 | M20: 65.10 | N20: =H20+J20+L20+N20 -> 2128 | O20: =I20+K20+M20+O20 -> 123.61 | P20: =P20/Q20 -> 17.215435644365346 | Q20: =P20/2 -> 1064.0
B21: 6 | C21: Jonty Mayo | D21: 60 mins | E21: Male | F21: 0 | H21: 880 | I21: 55.08 | J21: 0 | L21: 1070 | M21: 58.44 | N21: =H21+J21+L21+N21 -> 1950 | O21: =I21+K21+M21+O21 -> 113.52 | P21: =P21/Q21 -> 17.177589852008456 | Q21: =P21/2 -> 975.0
B22: 7 | C22: Paul Ferguson | D22: 60 mins | E22: Male | F22: 0 | H22: 1029 | I22: 65.04 | J22: 848 | K22: 66.00 | L22: 0 | N22: =H22+J22+L22+N22 -> 1877 | O22: =I22+K22+M22+O22 -> 131.04 | P22: =P22/Q22 -> 14.323870573870572 | Q22: =P22/2 -> 938.5
B23: 8 | C23: Matt Foxwell | D23: 60 mins | E23: Male | F23: 0 | H23: 510 | I23: 57.12 | J23: 200 | K23: 27.24 | L23: 880 | M23: 56.25 | N23: =H23+J23+L23+N23 -> 1590 | O23: =I23+K23+M23+O23 -> 140.61 | P23: =P23/Q23 -> 11.307872839769574 | Q23: =P23/3 -> 530.0
B24: 9 | C24: Loz Colyer | D24: 60mins | E24: Male | F24: 0 | H24: 0 | J24: 630 | K24: 60.00 | L24: 908 | M24: 76.00 | N24: =H24+J24+L24+N24 -> 1538 | O24: =I24+K24+M24+O24 -> 136.00 | P24: =P24/Q24 -> 11.308823529411764 | Q24: =P24/2 -> 769.0
B25: 10 | C25: David Mannering | D25: 60 mins | E25: Male | F25: 500 | G25: 29.35 | H25: 860 | I25: 57.25 | J25: 0 | L25: 0 | N25: =H25+J25+L25+N25 -> 1360 | O25: =I25+K25+M25+O25 -> 86.60 | P25: =P25/Q25 -> 15.704387990762125 | Q25: =P25/2 -> 680.0
B26: 11 | C26: George Robertson | D26: 60 mins | E26: Male | F26: 0 | H26: 0 | J26: 900 | K26: 59.10 | L26: 0 | N26: =H26+J26+L26+N26 -> 900 | O26: =I26+K26+M26+O26 -> 59.10 | P26: =P26/Q26 -> 15.228426395939087 | Q26: =P26/1 -> 900.0
B27: 12 | C27: Rigby Jerram | D27: 60 mins | E27: Male | F27: 870 | G27: 56.17 | H27: 0 | J27: 0 | L27: 0 | N27: =H27+J27+L27+N27 -> 870 | O27: =I27+K27+M27+O27 -> 56.17 | P27: =P27/Q27 -> 15.48869503293573 | Q27: =P27/1 -> 870.0
B28: 13 | C28: Chris Speight | D28: 60 mins | E28: Male | F28: 808 | G28: 60.10 | H28: 0 | J28: 0 | L28: 0 | N28: =H28+J28+L28+N28 -> 808 | O28: =I28+K28+M28+O28 -> 60.10 | P28: =P28/Q28 -> 13.444259567387688 | Q28: =P28/1 -> 808.0
B29: 14 | C29: David Neate | D29: 60 mins | E29: Male | F29: 0 | H29: 268 | I29: 30.10 | J29: 0 | L29: 520 | M29: 60.00 | N29: =H29+J29+L29+N29 -> 788 | O29: =I29+K29+M29+O29 -> 90.10 | P29: =P29/Q29 -> 8.745837957824639 | Q29: =P29/2 -> 394.0
B30: 15 | C30: Graham Walkden | D30: 60 mins | E30: Male | F30: 768 | G30: 60.08 | H30: 0 | J30: 0 | L30: 0 | N30: =H30+J30+L30+N30 -> 768 | O30: =I30+K30+M30+O30 -> 60.08 | P30: =P30/Q30 -> 12.78295605858855 | Q30: =P30/1 -> 768.0
B31: 16 | C31: Simon Maytum | D31: 60 mins | E31: Male | F31: 0 | H31: 744 | I31: 60.29 | J31: 0 | L31: 0 | N31: =H31+J31+L31+N31 -> 744 | O31: =I31+K31+M31+O31 -> 60.29 | P31: =P31/Q31 -> 12.340354951069829 | Q31: =P31/1 -> 744.0
B32: 17 | C32: Paul Gibling | D32: 60 mins | E32: Male | F32: 710 | G32: 60.50 | H32: 0 | J32: 0 | L32: 0 | N32: =H32+J32+L32+N32 -> 710 | O32: =I32+K32+M32+O32 -> 60.50 | P32: =P32/Q32 -> 11.735537190082646 | Q32: =P32/1 -> 710.0
B33: 18 | C33: Gareth Thomas | D33: 60 mins | E33: Male | F33: 0 | H33: 694 | I33: 63.49 | J33: 0 | L33: 0 | N33: =H33+J33+L33+N33 -> 694 | O33: =I33+K33+M33+O33 -> 63.49 | P33: =P33/Q33 -> 10.930855252795716 | Q33: =P33/1 -> 694.0
B34: 19 | C34: Tony Richardson | D34: 60 mins | E34: Male | F34: 689 | G34: 60.55 | H34: 0 | J34: 0 | L34: 0 | N34: =H34+J34+L34+N34 -> 689 | O34: =I34+K34+M34+O34 -> 60.55 | P34: =P34/Q34 -> 11.379025598678778 | Q34: =P34/1 -> 689.0
B35: 20 | C35: Phil Whitehurst | D35: 60 mins | E35: Male | F35: 550 | G35: 59.40 | H35: 0 | J35: 0 | L35: 0 | N35: =H35+J35+L35+N35 -> 550 | O35: =I35+K35+M35+O35 -> 59.40 | P35: =P35/Q35 -> 9.2592592592592595 | Q35: =P35/1 -> 550.0
B36: 21 | C36: Richard Day | D36: 60 mins | E36: Male | F36: 520 | G36: 58.50 | H36: 0 | J36: 0 | L36: 0 | N36: =H36+J36+L36+N36 -> 520 | O36: =I36+K36+M36+O36 -> 58.50 | P36: =P36/Q36 -> 8.8888888888888893 | Q36: =P36/1 -> 520.0
B37: 22 | C37: Rob Marriott | D37: 60 mins | E37: Male | F37: 500 | G37: 53.35 | H37: 0 | J37: 0 | L37: 0 | N37: =H37+J37+L37+N37 -> 500 | O37: =I37+K37+M37+O37 -> 53.35 | P37: =P37/Q37 -> 9.3720712277413298 | Q37: =P37/1 -> 500.0
B38: 23 | C38: David Wolfendale | D38: 60 mins | E38: Male | F38: 0 | H38: 0 | J38: 390 | K38: 53.39 | L38: 0 | N38: =H38+J38+L38+N38 -> 390 | O38: =I38+K38+M38+O38 -> 53.39 | P38: =P38/Q38 -> 7.3047387151151897 | Q38: =P38/1 -> 390.0
B40: 1 | C40: Thomas & Laura Chaldecott | D40: 60 mins | E40: Junior | F40: 472 | G40: 64.50 | H40: 560 | I40: 57.25 | J40: 290 | K40: 53.41 | L40: 610 | M40: 57.40 | N40: =H39+J39+L39+N39 -> 1932 | O40: =I39+K39+M39+O39 -> 232.56 | P40: =P39/Q39 -> 8.3075335397316827 | Q40: =P39/4 -> 483.0
B41: 2 | C41: James Allison | D41: 30 mins | E41: Junior | F41: 230 | G41: 28.45 | H41: 0 | J41: 0 | L41: 330 | M41: 30.04 | N41: =H40+J40+L40+N40 -> 560 | O41: =I40+K40+M40+O40 -> 58.49 | P41: =P40/Q40 -> 9.5742862027697058 | Q41: =P40/2 -> 280.0
B42: 3 | C42: Emily Neate | D42: 60 mins | E42: Junior | F42: 490 | G42: 53.45 | H42: 0 | J42: 0 | L42: 0 | N42: =H41+J41+L41+N41 -> 490 | O42: =I41+K41+M41+O41 -> 53.45 | P42: =P41/Q41 -> 9.1674462114125355 | Q42: =P41/1 -> 490.0
B43: 4 | C43: Stewart Allison | D43: 30 mins | E43: Junior | L43: 270 | M43: 27.15 | N43: =H42+J42+L42+N42 -> 270 | O43: =I42+K42+M42+O42 -> 27.15 | P43: =P42/Q42 -> 9.94475138121547 | Q43: =P42/1 -> 270.0
B44: 5 | C44: Karl, Danny, Darren | D44: 60 mins | E44: Junior | F44: 0 | H44: 0 | J44: 260 | K44: 38.40 | L44: 0 | N44: =H43+J43+L43+N43 -> 260 | O44: =I43+K43+M43+O43 -> 38.40 | P44: =P43/Q43 -> 6.7708333333333339 | Q44: =P43/1 -> 260.0
B45: 6 | C45: Neate Family | D45: 30 mins | E45: Junior | F45: 244 | G45: 33.00 | H45: 0 | J45: 0 | L45: 0 | N45: =H44+J44+L44+N44 -> 244 | O45: =I44+K44+M44+O44 -> 33.00 | P45: =P44/Q44 -> 7.3939393939393936 | Q45: =P44/1 -> 244.0
B47: 1 | C47: Janet Nash | D47: 60 mins | E47: Female | F47: 740 | G47: 59.20 | H47: 703 | I47: 65.35 | J47: 470 | K47: 59.10 | L47: 820 | M47: 59.28 | N47: =H45+J45+L45+N45 -> 2733 | O47: =I45+K45+M45+O45 -> 242.93 | P47: =P45/Q45 -> 11.250154365455069 | Q47: =P45/4 -> 683.25
B48: 2 | C48: Diana Stamp | D48: 60 mins | E48: Female | F48: 560 | G48: 58.15 | H48: 620 | I48: 57.31 | J48: 470 | K48: 59.48 | L48: 722 | M48: 60.40 | N48: =H46+J46+L46+N46 -> 2372 | O48: =I46+K46+M46+O46 -> 235.34 | P48: =P46/Q46 -> 10.07903458825529 | Q48: =P46/4 -> 593.0
B49: 3 | C49: Debbie Thomson | D49: 60 mins | E49: Female | F49: 0 | H49: 740 | I49: 59.20 | J49: 580 | K49: 58.00 | L49: 932 | M49: 60.20 | N49: =H47+J47+L47+N47 -> 2252 | O49: =I47+K47+M47+O47 -> 177.40 | P49: =P47/Q47 -> 12.694475760992107 | Q49: =P47/3 -> 750.66666666666663
B50: 4 | C50: Sue Owen | D50: 60 mins | E50: Female | F50: 690 | G50: 59.15 | H50: 792 | I50: 60.36 | J50: 539 | K50: 62.31 | L50: 0 | N50: =H48+J48+L48+N48 -> 2021 | O50: =I48+K48+M48+O48 -> 181.82 | P50: =P48/Q48 -> 11.115388846111539 | Q50: =P48/3 -> 673.66666666666663
B51: 5 | C51: Pauline Richardson | D51: 60 mins | E51: Female | F51: 510 | G51: 59.30 | H51: 574 | I51: 63.00 | J51: 0 | L51: 640 | M51: 58.00 | N51: =H49+J49+L49+N49 -> 1724 | O51: =I49+K49+M49+O49 -> 180.30 | P51: =P49/Q49 -> 9.5618413754853009 | Q51: =P49/3 -> 574.66666666666663
B52: 6 | C52: Glenis Ferguson | D52: 60 mins | E52: Female | F52: 0 | H52: 650 | I52: 57.27 | J52: 500 | K52: 60.00 | L52: 0 | N52: =H50+J50+L50+N50 -> 1150 | O52: =I50+K50+M50+O50 -> 117.27 | P52: =P50/Q50 -> 9.8064296068900827 | Q52: =P50/2 -> 575.0
B53: 7 | C53: Charlotte Webb | D53: 60 mins | E53: Female | F53: 476 | G53: 65.16 | H53: 244 | I53: 62.58 | J53: 380 | K53: 51.15 | L53: 0 | N53: =H51+J51+L51+N51 -> 1100 | O53: =I51+K51+M51+O51 -> 178.89 | P53: =P51/Q51 -> 6.1490301302476391 | Q53: =P51/2 -> 550.0
B54: 8 | C54: Sarah Fulwood | D54: 60 mins | E54: Female | F54: 0 | H54: 0 | J54: 230 | K54: 34.16 | L54: 0 | N54: =H52+J52+L52+N52 -> 230 | O54: =I52+K52+M52+O52 -> 34.16 | P54: =P52/Q52 -> 6.7330210772833734 | Q54: =P52/1 -> 230.0
B56: 1 | C56: David Downes | D56: 60 mins | E56: Biker | F56: 760 | G56: 58.40 | H56: 0 | J56: 630 | K56: 57.35 | L56: 1120 | M56: 59.23 | N56: =H53+J53+L53+N53 -> 2510 | O56: =I53+K53+M53+O53 -> 174.98 | P56: =P53/Q53 -> 14.344496513887302 | Q56: =P53/3 -> 836.66666666666663
B57: 2 | C57: Heather Meek | D57: 60 mins | E57: Biker | F57: 0 | H57: 490 | I57: 61.40 | J57: 0 | L57: 0 | N57: =H54+J54+L54+N54 -> 490 | O57: =I54+K54+M54+O54 -> 61.40 | P57: =P54/Q54 -> 7.9804560260586319 | Q57: =P54/1 -> 490.0
B58: 3 | C58: Anne David | D58: 60 mins | E58: Biker | F58: 0 | H58: 464 | I58: 88.00 | J58: 0 | L58: 0 | N58: =H55+J55+L55+N55 -> 464 | O58: =I55+K55+M55+O55 -> 88.00 | P58: =P55/Q55 -> 5.2727272727272725 | Q58: =P55/1 -> 464.0
B59: 4 | C59: Nick Mortimer | D59: 30 mins | E59: Biker | F59: 0 | H59: 310 | I59: 27.04 | J59: 0 | L59: 0 | N59: =H56+J56+L56+N56 -> 310 | O59: =I56+K56+M56+O56 -> 27.04 | P59: =P56/Q56 -> 11.464497041420119 | Q59: =P56/1 -> 310.0