A3: Staveley Street O Organiser: George Robertson - 24.6.2001
A4: Name | D4: Time | E4: Penalties | F4: Points | G4: Adjusted
G5: Score
A7: Tony Richardson | D7: 57.18 | E7: 0 | F7: 820 | G7: =F7-E7 -> 820
A8: Derek Fryer | D8: 58.07 | E8: 0 | F8: 820 | G8: =F8-E8 -> 820
A9: Pauline Richardson | D9: 57.15 | E9: 0 | F9: 770 | G9: =F9-E9 -> 770
A10: John Nash | D10: 59.10 | E10: 0 | F10: 770 | G10: =F10-E10 -> 770
A11: Beryl Offley | D11: 57.56 | E11: 0 | F11: 750 | G11: =F11-E11 -> 750
A12: Paul Williams | D12: 60.36 | E12: 6 | F12: 750 | G12: =F12-E12 -> 744
A13: Steve Spooner | D13: 53.10 | E13: 0 | F13: 710 | G13: =F13-E13 -> 710
A14: Janet Nash | D14: 57.57 | E14: 0 | F14: 660 | G14: =F14-E14 -> 660
A15: Steve Burge | D15: 52.20 | E15: 0 | F15: 640 | G15: =F15-E15 -> 640
A16: Helen Livesey | D16: 51.38 | E16: 0 | F16: 640 | G16: =F16-E16 -> 640
A17: Mike Hobson | D17: 56.15 | E17: 0 | F17: 630 | G17: =F17-E17 -> 630
A18: Graham W. and Marion I. | D18: 27.18 | E18: 0 | F18: 400 | G18: =F18-E18 -> 400 | H18: ** 30 min course
A19: Nicola Robertson | D19: 47.37 | E19: 0 | F19: 370 | G19: =F19-E19 -> 370
A20: Scott Robertson | D20: 22.14 | E20: 0 | F20: 350 | G20: =F20-E20 -> 350 | H20: ** 30 min course
A21: Jenny Rhodes | D21: 52.44 | E21: 0 | F21: 320 | G21: =F21-E21 -> 320
A22: Michael Rhodes | D22: 50.10 | E22: 0 | F22: 290 | G22: =F22-E22 -> 290
A23: Alison Fryer | D23: 29.59 | E23: 0 | F23: 270 | G23: =F23-E23 -> 270 | H23: ** 30 min course
A24: John Offley | D24: 29.50 | E24: 0 | F24: 230 | G24: =F24-E24 -> 230 | H24: ** 30 min course
A26: Maximum number of points available 820