A3: Kendal Street O series 2002 | E3: Click here for final results tables...
A4: Event 4, Staveley Results
E5: Points | F5: Time | G5: Time | H5: Adjusted | I5: Average Score
B6: Name | C6: Class | D6: Category | E6: Scored | F6: Taken | G6: Penalties | H6: Score | I6: Rate Points/min.
A8: 1 | B8: Derek Fryer | C8: 60 mins | D8: Male | E8: 1310 | F8: 65.10 | G8: 62 | H8: =H8-J8 -> 1248 | I8: =K8/I8 -> 19.170506912442399
A9: 2 | B9: Phil Clarke | C9: 60 mins | D9: Male | E9: 1140 | F9: 57.44 | G9: 0 | H9: =H9-J9 -> 1140 | I9: =K9/I9 -> 19.846796657381617
A10: 3 | B10: David Downes | C10: 60 mins | D10: Biker | E10: 1120 | F10: 59.23 | G10: 0 | H10: =H10-J10 -> 1120 | I10: =K10/I10 -> 18.909336484889415
A11: 4 | B11: Jonty Mayo | C11: 60 mins | D11: Male | E11: 1070 | F11: 58.44 | G11: 0 | H11: =H11-J11 -> 1070 | I11: =K11/I11 -> 18.30937713894593
A12: 5 | B12: Martin Weeks | C12: 60 mins | D12: Male | E12: 1130 | F12: 68.04 | G12: 97 | H12: =H12-J12 -> 1033 | I12: =K12/I12 -> 15.182245737801292
A13: 6 | B13: Diane & Nigel Walker | C13: 60 mins | D13: Pairs | E13: 970 | F13: 60.11 | G13: 3 | H13: =H13-J13 -> 967 | I13: =K13/I13 -> 16.087173515222094
A14: 7 | B14: Debbie Thompson | C14: 60 mins | D14: Female | E14: 936 | F14: 60.20 | G14: 4 | H14: =H14-J14 -> 932 | I14: =K14/I14 -> 15.481727574750829
A15: 8 | B15: Loz Colyer | C15: 60 mins | D15: Male | E15: 1100 | F15: 76.00 | G15: 192 | H15: =H15-J15 -> 908 | I15: =K15/I15 -> 11.947368421052632
A16: 9 | B16: Mike Hyde | C16: 60 mins | D16: Male | E16: 900 | F16: 55.15 | G16: 0 | H16: =H16-J16 -> 900 | I16: =K16/I16 -> 16.319129646418858
A17: 10 | B17: Matt Foxwell | C17: 60 mins | D17: Male | E17: 880 | F17: 56.25 | G17: 0 | H17: =H17-J17 -> 880 | I17: =K17/I17 -> 15.644444444444444
A18: 11 | B18: John Nash | C18: 60 mins | D18: Male | E18: 880 | F18: 59.00 | G18: 0 | H18: =H18-J18 -> 880 | I18: =K18/I18 -> 14.915254237288135
A19: 12 | B19: Janet Nash | C19: 60 mins | D19: Female | E19: 820 | F19: 59.28 | G19: 0 | H19: =H19-J19 -> 820 | I19: =K19/I19 -> 13.832658569500675
A20: 13 | B20: Gill & Roger Chaldecott | C20: 60 mins | D20: Pairs | E20: 790 | F20: 60.50 | G20: 11 | H20: =H20-J20 -> 779 | I20: =K20/I20 -> 12.87603305785124
A21: 14 | B21: Diana Stamp | C21: 60 mins | D21: Female | E21: 730 | F21: 60.40 | G21: 8 | H21: =H21-J21 -> 722 | I21: =K21/I21 -> 11.95364238410596
A22: 15 | B22: Pauline Richardson | C22: 60 mins | D22: Female | E22: 640 | F22: 58.00 | G22: 0 | H22: =H22-J22 -> 640 | I22: =K22/I22 -> 11.03448275862069
A23: 16 | B23: Thomas & Laura Chaldecott | C23: 60 mins | D23: Junior | E23: 610 | F23: 57.40 | G23: 0 | H23: =H23-J23 -> 610 | I23: =K23/I23 -> 10.627177700348433
A24: 17 | B24: David Neate | C24: 60 mins | D24: Male | E24: 520 | F24: 60.00 | G24: 0 | H24: =H24-J24 -> 520 | I24: =K24/I24 -> 8.6666666666666661
A25: 18 | B25: James Allison | C25: 60 mins | D25: Junior | E25: 330 | F25: 30.04 | G25: 0 | H25: =H25-J25 -> 330 | I25: =K25/I25 -> 10.985352862849535
A26: 19 | B26: Stewart Allison | C26: 60 mins | D26: Junior | E26: 270 | F26: 27.15 | G26: 0 | H26: =H26-J26 -> 270 | I26: =K26/I26 -> 9.94475138121547