A1: Name | B1: time | C1: pts | D1: pens | E1: total
A3: Iain Smith | B3: 53 | C3: 350 | E3: =SUM(C3-D3) -> 350
A4: Derek Fryer | B4: 61 | C4: 350 | D4: 10 | E4: =SUM(C4-D4) -> 340
A5: Paul Ferguson | B5: 58 | C5: 330 | E5: =SUM(C5-D5) -> 330
A6: David Downes | B6: 62 | C6: 320 | D6: 20 | E6: =SUM(C6-D6) -> 300
A7: David Whitaker | B7: 55 | C7: 260 | E7: =SUM(C7-D7) -> 260
A8: Mel Perry | B8: 62 | C8: 250 | D8: 20 | E8: =SUM(C8-D8) -> 230
A9: Sheila Hobson | B9: 61 | C9: 220 | D9: 10 | E9: =SUM(C9-D9) -> 210
A10: Wray & Margaret Brocklebank | B10: 51 | C10: 190 | E10: =SUM(C10-D10) -> 190
A11: Alyson Knowles | B11: 52 | C11: 160 | E11: =SUM(C11-D11) -> 160
A12: Glenys Ferguson | B12: 59 | C12: 160 | E12: =SUM(C12-D12) -> 160
A14: Juniors
A15: Thomas Spooner
A16: & Douglas Thurgoot | B16: 55 | C16: 180 | E16: =SUM(C16-D16) -> 180
A17: Gareth Knowles | B17: 59 | C17: 100 | E17: =SUM(C17-D17) -> 100
A18: Jeffery Dixon | B18: 79 | C18: 210 | D18: 190 | E18: =SUM(C18-D18) -> 20