A1: Name | B1: Time | C1: Points | D1: Penalties | E1: Total
A3: Ed Nash | B3: 58.00 | C3: 1820 | E3: =SUM(C3-D3) -> 1820
A4: Mel Perry | B4: 65.30 | C4: 2040 | D4: 300 | E4: =SUM(C4-D4) -> 1740
A5: Beryl Offley | B5: 55.00 | C5: 1480 | E5: =SUM(C5-D5) -> 1480
A6: John Nash | B6: 60.00 | C6: 980 | E6: =SUM(C6-D6) -> 980
A7: Brian Spain | B7: 65.00 | C7: 1080 | D7: 250 | E7: =SUM(C7-D7) -> 830
A8: Janet Nash | B8: 59.40 | C8: 820 | E8: =SUM(C8-D8) -> 820
A9: Will Spain | B9: 53.00 | C9: 680 | E9: =SUM(C9-D9) -> 680
A10: Hannah & Teresa Perry | B10: 65.55 | C10: 660 | D10: 300 | E10: =SUM(C10-D10) -> 360
A11: John Offley | B11: 65.00 | C11: 580 | D11: 250 | E11: =SUM(C11-D11) -> 330
A12: Sue & Hamish Fletcher | B12: 62.00 | C12: 350 | D12: 40 | E12: =SUM(C12-D12) -> 310