A1: Grange Street Event - 15.4.2001
A2: Organiser: Iain Smith | B2: Results queries: iainsmith@clara.net

A1: Name | B1: Time | C1: Points | D1: Pens | E1: Total
A3: Chris Roberts | B3: 61.30 | C3: 1380 | D3: 10 | E3: =SUM(C3-D3) -> 1370
A4: Keith Henderson | B4: 61.17 | C4: 1320 | D4: 10 | E4: =SUM(C4-D4) -> 1310
A5: Beryl Offley | B5: 57 | C5: 1280 | E5: =SUM(C5-D5) -> 1280
A6: Mel Perry | B6: 59 | C6: 1270 | E6: =SUM(C6-D6) -> 1270
A7: Andrew Hobson | B7: 60 | C7: 1190 | E7: =SUM(C7-D7) -> 1190
A8: Sheila Hobson | B8: 56 | C8: 1120 | E8: =SUM(C8-D8) -> 1120
A9: Loz Colyer + 1 | B9: 58 | C9: 1110 | E9: =SUM(C9-D9) -> 1110
A10: Dave Downes | B10: 62 | C10: 1110 | D10: 5 | E10: =SUM(C10-D10) -> 1105
A11: Rebecca Roberts | B11: 52 | C11: 1070 | E11: =SUM(C11-D11) -> 1070
A12: Derek Fryer | B12: 40 | C12: 1060 | E12: 1060
A13: George Robertson | B13: 60 | C13: 1050 | E13: =SUM(C13-D13) -> 1050
A14: Mike Hobson | B14: 58 | C14: 1040 | E14: =SUM(C14-D14) -> 1040
A15: David Clapp | B15: 66 | C15: 980 | D15: 30 | E15: =SUM(C15-D15) -> 950
A16: Erica Clapp | B16: 56 | C16: 920 | E16: =SUM(C16-D16) -> 920
A17: Sue Courchee | B17: 56 | C17: 820 | E17: =SUM(C17-D17) -> 820
A18: Perry Gang/Tribe | B18: 49 | C18: 780 | E18: =SUM(C18-D18) -> 780
A19: Bill Ridings | B19: 57 | C19: 660 | E19: =SUM(C19-D19) -> 660
A20: Sophie Roberts | B20: 48 | C20: 610 | E20: =SUM(C20-D20) -> 610
A21: Myra Robertson | B21: 52 | C21: 600 | E21: =SUM(C21-D21) -> 600
A22: Team Sam | B22: 43 | C22: 560 | E22: =SUM(C22-D22) -> 560
A23: Jim Young | B23: 59 | C23: 550 | E23: =SUM(C23-D23) -> 550
A24: Alison/Lucy Fryer | B24: 31 | C24: 540 | E24: 540

A1: Pat McVey | B1: 59 | C1: 1300 | E1: 1300
A2: Chris Ellison | B2: 57 | C2: 1290 | E2: 1290
A3: Dick Courchee | B3: 58 | C3: 1230 | E3: 1230
A4: Tim Field | B4: 61 | C4: 790 | E4: 790