1: Name | B1: Time | C1: Points | D1: Penalties | E1: Adjusted Scores
3: Iain Smith | B3: 57.46 | C3: 760 | D3: 0 | E3: =E3-F3 -> 760
4: Paul Ferguson | B4: 57.59 | C4: 720 | D4: 0 | E4: =E4-F4 -> 720
5: Loz Colyer | B5: 58.14 | C5: 670 | D5: 0 | E5: =E5-F5 -> 670
6: Janet Nash | B6: 62.09 | C6: 620 | D6: 22 | E6: =E6-F6 -> 598
7: John Nash | B7: 58.32 | C7: 570 | D7: 0 | E7: =E7-F7 -> 570
8: Steve + Abi | B8: 58.12 | C8: 510 | D8: 0 | E8: =E8-F8 -> 510
9: Glenys Ferguson | B9: 58.39 | C9: 480 | D9: 0 | E9: =E9-F9 -> 480
10: Scott | A10: u16 | B10: 60.41 | C10: 280 | D10: 9 | E10: =E10-F10 -> 271
11: Sue + Hamish Fletcher | B11: 59.15 | C11: 270 | D11: 0 | E11: =E11-F11 -> 270
12: Russell + Danny | A12: u16 | B12: 56.39 | C12: 250 | D12: 0 | E12: =E12-F12 -> 250
13: Nicola + Emily | A13: u16 | B13: 89.00 | C13: 400 | D13: 290 | E13: =E13-F13 -> 110

A1: Thanks to all runners for taking part, above are the revised scores after checking. A few runners have lost points as incorrect answers were found on control sheets during checking. We hope to run a few more events in coming weeks I will most likely move back to the mid week dates as we seen to get a larger turnout.