A3: Kendal Street O series 2002
A4: Event 2 Results
E5: Points | F5: Time | G5: Time | H5: Adjusted
B6: Name | C6: Class | D6: Category | E6: Scored | F6: Taken | G6: Penalties | H6: Score
A8: 1 | B8: Phil Clarke | C8: 60 mins | D8: Male | E8: 1060 | F8: 60.10 | G8: 2 | H8: =H8-J8 -> 1058
A9: 2 | B9: Paul Ferguson | C9: 60 mins | D9: Male | E9: 1090 | F9: 65.04 | G9: 61 | H9: =H9-J9 -> 1029
A10: 3 | B10: Jonty Mayo | C10: 60 mins | D10: Male | E10: 880 | F10: 55.08 | G10: 0 | H10: =H10-J10 -> 880
A11: 4 | B11: Derek Fryer | C11: 60 mins | D11: Male | E11: 880 | F11: 58.51 | G11: 0 | H11: =H11-J11 -> 880
A12: 5 | B12: David Mannering | C12: 60 mins | D12: Male | E12: 860 | F12: 57.25 | G12: 0 | H12: =H12-J12 -> 860
A13: 6 | B13: Martin Weeks | C13: 60 mins | D13: Male | E13: 930 | F13: 69.02 | G13: 109 | H13: =H13-J13 -> 821
A14: 7 | B14: Sue Owen | C14: 60 mins | D14: Female | E14: 800 | F14: 60.36 | G14: 8 | H14: =H14-J14 -> 792
A15: 8 | B15: Mike Hind | C15: 60 mins | D15: Male | E15: 760 | F15: 56.21 | G15: 0 | H15: =H15-J15 -> 760
A16: 9 | B16: Simon Maytum | C16: 60 mins | D16: Male | E16: 750 | F16: 60.29 | G16: 6 | H16: =H16-J16 -> 744
A17: 10 | B17: Debbie Thompson | C17: 60 mins | D17: Female | E17: 740 | F17: 59.20 | G17: 0 | H17: =H17-J17 -> 740
A18: 11 | B18: Diane & Nigel Walker | C18: 60 mins | D18: Pairs | E18: 730 | F18: 58.14 | G18: 0 | H18: =H18-J18 -> 730
A19: 12 | B19: Steve Preistly + Christine | C19: 60 mins | D19: Pairs | E19: 730 | F19: 58.16 | G19: 0 | H19: =H19-J19 -> 730
A20: 13 | B20: John Nash | C20: 60 mins | D20: Male | E20: 730 | F20: 60.20 | G20: 4 | H20: =H20-J20 -> 726
A21: 14 | B21: Janet Nash | C21: 60 mins | D21: Female | E21: 770 | F21: 65.35 | G21: 67 | H21: =H21-J21 -> 703
A22: 15 | B22: Gareth Thomas | C22: 60 mins | D22: Male | E22: 740 | F22: 63.49 | G22: 46 | H22: =H22-J22 -> 694
A23: 16 | B23: Glenis Ferguson | C23: 60 mins | D23: Female | E23: 650 | F23: 57.27 | G23: 0 | H23: =H23-J23 -> 650
A24: 17 | B24: Diana Stamp | C24: 60 mins | D24: Female | E24: 620 | F24: 57.31 | G24: 0 | H24: =H24-J24 -> 620
A25: 18 | B25: Heather, Diane + Rachel | C25: 60 mins | D25: Pairs | E25: 590 | F25: 58.43 | G25: 0 | H25: =H25-J25 -> 590
A26: 19 | B26: Pauline Richardson | C26: 60 mins | D26: Female | E26: 610 | F26: 63.00 | G26: 36 | H26: =H26-J26 -> 574
A27: 20 | B27: Thomas & Laura Chaldecott | C27: 60 mins | D27: Junior | E27: 560 | F27: 57.25 | G27: 0 | H27: =H27-J27 -> 560
A28: 21 | B28: Matt Foxwell | C28: 60 mins | D28: Male | E28: 510 | F28: 57.12 | G28: 0 | H28: =H28-J28 -> 510
A29: 22 | B29: Heather Meek | C29: 60 mins | D29: Biker | E29: 510 | F29: 61.40 | G29: 20 | H29: =H29-J29 -> 490
A30: 23 | B30: Anne David | C30: 60 mins | D30: Biker | E30: 820 | F30: 88.00 | G30: 356 | H30: =H30-J30 -> 464
A31: 24 | B31: Nick Mortimer | C31: 30 mins | D31: Biker | E31: 310 | F31: 27.04 | G31: 0 | H31: =H31-J31 -> 310
A32: 25 | B32: David Neate | C32: 30 mins | D32: Male | E32: 270 | F32: 30.10 | G32: 2 | H32: =H32-J32 -> 268
A33: 26 | B33: Charlotte Webb | C33: 60 mins | D33: Female | E33: 280 | F33: 62.58 | G33: 36 | H33: =H33-J33 -> 244