A3: Kendal Street O 2001
A4: Final Overall Positions 60 minute Score event
A5: Position | C5: Event 1 | D5: Event 2 | E5: Event 3 | F5: Total
A7: 1 | B7: Louise + Nick Sharp | C7: 670 | D7: 645 | E7: 740 | F7: =SUM(C7:E7) -> 2055
A8: 2 | B8: Jonty Mayo | C8: 540 | D8: 490 | E8: 640 | F8: =SUM(C8:E8) -> 1670
A9: 3 | B9: Jon Broxap | C9: 530 | D9: 428 | E9: 570 | F9: =SUM(C9:E9) -> 1528
A10: 4 | B10: Graham Walkden | C10: 550 | D10: 478 | E10: 480 | F10: =SUM(C10:E10) -> 1508
A11: 5 | B11: Ken Dacre | C11: 460 | D11: 395 | E11: 610 | F11: =SUM(C11:E11) -> 1465
A12: 6 | B12: Sue Owen | C12: 500 | D12: 460 | E12: 420 | F12: =SUM(C12:E12) -> 1380
A13: 7 | B13: Phil Clark | C13: 0 | D13: 580 | E13: 720 | F13: =SUM(C13:E13) -> 1300
A14: 8 | B14: Steve Preistley + 1 | C14: 440 | D14: 335 | E14: 520 | F14: =SUM(C14:E14) -> 1295
A15: 9 | B15: Paul Ferguson | C15: 0 | D15: 561 | E15: 690 | F15: =SUM(C15:E15) -> 1251
A16: 10 | B16: Janet Nash | C16: 380 | D16: 347 | E16: 470 | F16: =SUM(C16:E16) -> 1197
A17: 11 | B17: Andrew Walker | C17: 0 | D17: 570 | E17: 626 | F17: =SUM(C17:E17) -> 1196
A18: 12 | B18: Mark Walker + 1 | C18: 430 | D18: 338 | E18: 370 | F18: =SUM(C18:E18) -> 1138
A19: 13 | B19: Mike Hyde | C19: 0 | D19: 530 | E19: 540 | F19: =SUM(C19:E19) -> 1070
A20: 14 | B20: David Neate + 2 | C20: 0 | D20: 530 | E20: 523 | F20: =SUM(C20:E20) -> 1053
A21: 15 | B21: Russ Graves | C21: 220 | D21: 330 | E21: 380 | F21: =SUM(C21:E21) -> 930
A22: 16 | B22: John Nash | C22: 380 | D22: 499 | E22: 0 | F22: =SUM(C22:E22) -> 879
A23: 17 | B23: Glenys Ferguson | C23: 0 | D23: 344 | E23: 477 | F23: =SUM(C23:E23) -> 821
A24: 18 | B24: Diana Stamp | C24: 0 | D24: 410 | E24: 370 | F24: =SUM(C24:E24) -> 780
A25: 19 | B25: Diane Walker + 1 | C25: 0 | D25: 231 | E25: 523 | F25: =SUM(C25:E25) -> 754
A26: 20 | B26: Pauline Richardson | C26: 0 | D26: 230 | E26: 410 | F26: =SUM(C26:E26) -> 640
A27: 21 | B27: Nicola Robertson + 1 | C27: 0 | D27: 240 | E27: 370 | F27: =SUM(C27:E27) -> 610
A28: 22 | B28: David Rosen | C28: 0 | D28: 0 | E28: 590 | F28: =SUM(C28:E28) -> 590
A29: 23 | B29: John Bagge | C29: 0 | D29: 0 | E29: 530 | F29: =SUM(C29:E29) -> 530
A30: 24 | B30: David Manwaring + Dan | C30: 0 | D30: 0 | E30: 510 | F30: =SUM(C30:E30) -> 510
A31: 25= | B31: Sean Onions +1 | C31: 500 | D31: 0 | E31: 0 | F31: =SUM(C31:E31) -> 500
A32: 25= | B32: Helen + Marion | C32: 0 | D32: 0 | E32: 450 | F32: =SUM(C32:E32) -> 450
A33: 27 | B33: Tony Richardson | C33: 0 | D33: 0 | E33: 450 | F33: =SUM(C33:E33) -> 450
A34: 28 | B34: Andrew Williams + 1 | C34: 0 | D34: 0 | E34: 440 | F34: =SUM(C34:E34) -> 440
A35: 29 | B35: Tony Rockey+ John Taylor | C35: 0 | D35: 0 | E35: 420 | F35: =SUM(C35:E35) -> 420
A36: 30 | B36: Richard Moseley +1 | C36: 0 | D36: 350 | E36: 0 | F36: =SUM(C36:E36) -> 350
A37: 31 | B37: Paul Williams | C37: 0 | D37: 0 | E37: 340 | F37: =SUM(C37:E37) -> 340
A38: 32 | B38: Terrasa + Rachel | C38: 0 | D38: 0 | E38: 310 | F38: =SUM(C38:E38) -> 310
A39: 33 | B39: Ian Jones | C39: 0 | D39: 308 | E39: 0 | F39: =SUM(C39:E39) -> 308
A40: 34 | B40: Chris Rowley | C40: 0 | D40: 0 | E40: 300 | F40: =SUM(C40:E40) -> 300
A41: 35 | B41: Heather Goodman + 1 | C41: 0 | D41: 270 | E41: 0 | F41: =SUM(C41:E41) -> 270
A42: 36 | B42: Bill Ridings | C42: 260 | D42: 0 | E42: 0 | F42: =SUM(C42:E42) -> 260
A43: 37 | B43: Andy Williams +2 | C43: 230 | D43: 0 | E43: 0 | F43: =SUM(C43:E43) -> 230
A44: 38 | B44: Ian Cole + Emily | C44: 0 | D44: 0 | E44: 180 | F44: =SUM(C44:E44) -> 180
A45: 39 | B45: The Richards Family | C45: 0 | D45: 0 | E45: 100 | F45: =SUM(C45:E45) -> 100
A49: Overall Positions 30 minute Score event
A51: 1 | B51: Jude Onions +1 | C51: 180 | D51: 0 | E51: 370 | F51: =SUM(C51:E51) -> 550